Title,Year,Director,Cast,Genre,Duration
green zone,2010,paul greengrass,"amy ryan, brendan gleeson, greg kinnear, jason isaacs, khalid abdalla, matt damon, yigal naor","action, adventure, drama, thriller",115
greenberg,2010,noah baumbach,"ben stiller, brie larson, greta gerwig, jennifer jason leigh, mark duplass, rhys ifans","comedy, drama, romance",107
grown ups,2010,dennis dugan,"adam sandler, chris rock, david spade, kevin james, maria bello, rob schneider, salma hayek, steve buscemi",comedy,102
happy tears,2010,mitchell lichtenstein,"christian camargo, demi moore, ellen barkin, parker posey, rip torn","comedy, drama, indie",95
hereafter,2010,clint eastwood,"bryce dallas howard, cecile de france, derek jacobi, frankie mclaren, jay mohr, marthe keller, matt damon, thierry neuvic","drama, fantasy, mystery, thriller",129
holy rollers,2010,kevin asch,"ari graynor, danny a. abeckaser, elizabeth marvel, jason fuchs, jesse eisenberg, justin bartha, mark ivanir","crime, drama, thriller",89
hot tub time machine,2010,steve pink,"chevy chase, clark duke, craig robinson, crispin glover, john cusack, lizzy caplan, rob corddry","adventure, comedy, science fiction",101
how do you know?,2010,james l. brooks,"jack nicholson, kathryn hahn, mark linn baker, owen wilson, paul rudd, reese witherspoon","comedy, drama, romance, sport",121
hubble 3d,2010,toni myers,"andrew j. feustel, gregory c. johnson, leonardo dicaprio, scott d. altman",documentary,44
hyena,2015,gerard johnson,"elisa lasowski, myanna buring, neil maskell, peter ferdinando, richard dormer, stephen graham, tony pitts","crime, drama",112
i love you phillip morris,2010,"glenn ficarra, john requa","ewan mcgregor, jim carrey, leslie mann, michael mandel, rodrigo santoro","action, comedy, drama, romance",98
inception,2010,christopher nolan,"cillian murphy, dileep rao, ellen page, joseph gordon-levitt, ken watanabe, leonardo dicaprio, marion cotillard, michael caine, pete postlethwaite, tom berenger, tom hardy","action, science fiction, thriller",148
iron man 2,2010,favreau,"clark gregg, garry shandling, gwyneth paltrow, john slattery, mickey rourke, robert downey jr., sam rockwell, samuel l. jackson, scarlett johansson","action, adventure, science fiction, thriller",124
iron man,2008,jon favreau,"gwyneth paltrow, jeff bridges, robert downey jr., terrence howard","action, adventure, science fiction, thriller",126
jack goes boating,2010,philip seymour hoffman,"amy ryan, daphne rubin-vega, john ortiz, philip seymour hoffman, tom mccarthy","comedy, drama, indie, romance",89
jonah hex,2010,jimy hayward,"john gallagher jr., john malkovich, josh brolin, julia jones, megan fox, michael fassbender, michael shannon, tom wopat, wes bentley, will arnett","action, adventure, drama, science fiction, thriller, western",80
the joneses,2010,derrick borte,"amber heard, ben hollingsworth, david duchovny, demi moore, gary cole, glenne headly, lauren hutton","comedy, drama, indie",96
just wright,2010,sanaa hamri,"common, james pickens jr., pam grier, paula patton, phylicia rashad, queen latifah","comedy, drama, romance",100
kaboom,2011,gregg araki,"chris zylka, haley bennett, juno temple, nicole laliberte, roxane mesquida, thomas dekker","animation, comedy, family, fantasy, horror, science fiction",91
the karate kid,2010,harald zwart,"han wenwen, jackie chan, jaden smith, taraji p. henson","action, adventure, drama, family",140
kick-ass,2010,matthew vaughn,"aaron johnson, chloe grace moretz, christopher mintz-plasse, mark strong, michael rispoli, nicolas cage","action, adventure, comedy, foreign",117
the kids are all right,2010,lisa cholodenko,"annette bening, josh hutcherson, julianne moore, mark ruffalo, mia wasikowska","comedy, drama, indie",106
the killer inside me,2010,michael winterbottom,"bill pullman, casey affleck, elias koteas, jessica alba, kate hudson, ned beatty, simon baker","crime, drama, thriller",109
the last airbender,2010,m. night shyamalan,"aasif mandvi, cliff curtis, dev patel, jackson rathbone, nicola peltz, noah ringer, shaun toub","action, adventure, family, fantasy, science fiction",103
the last song,2010,julie anne robinson,"bobby coleman, greg kinnear, liam hemsworth, miley cyrus","drama, family, romance",107
leap year,2010,anand tucker,"adam scott, amy adams, john lithgow, matthew goode","comedy, romance",100
legendary,2010,mel damski,"danny glover, devon graye, john cena, madeleine martin, patricia clarkson, tyler posey","drama, indie",107
legion,2010,scott stewart,"adrianne palicki, charles s. dutton, dennis quaid, lucas black, paul bettany, tyrese gibson","action, adventure, fantasy, horror, mystery, suspense",100
let me in,2010,matt reeves,"chloe moretz, elias koteas, kodi smit-mcphee, richard jenkins","drama, foreign, horror, mystery",116
letters to juliet,2010,gary winick,"amanda seyfried, christopher egan, franco nero, gael garcia bernal, oliver platt, vanessa redgrave","comedy, drama, romance",105
life as we know it,2010,greg berlanti,"christina hendricks, hayes macarthur, josh duhamel, josh lucas, katherine heigl","comedy, romance",115
the losers,2010,sylvain white,"chris evans, columbus short, idris elba, jason patric, jeffrey dean morgan, oscar jaenada, zoe saldana","action, adventure, crime, drama, mystery, thriller",97
love ranch,2010,taylor hackford,"bai ling, gina gershon, helen mirren, joe pesci, scout taylor-compton, sergio peris-mencheta, taryn manning","drama, indie",117
love and other drugs,2010,edward zwick,"anne hathaway, gabriel macht, hank azaria, jake gyllenhaal, josh gad, oliver platt","comedy, drama, romance",112
macgruber,2010,jorma taccone,"kristen wiig, powers boothe, ryan phillippe, val kilmer, will forte","action, adventure, comedy, romance",90
machete,2010,ethan maniquis,"cheech marin, danny trejo, jessica alba, michelle rodriguez, robert de niro","action, adventure, crime, mystery, suspense, thriller",105
morning glory,2010,roger michell,"diane keaton, harrison ford, jeff goldblum, john pankow, matt malloy, patrick wilson, patti d'arbanville, rachel mcadams",comedy,102
mother and child,2010,rodrigo garcia,"amy brenneman, annette bening, cherry jones, david morse, elpidia carrillo, jimmy smits, kerry washington, naomi watts, s. epatha merkerson, samuel l. jackson","drama, romance",125
never let me go,2010,mark romanek,"andrew garfield, carey mulligan, charlotte rampling, keira knightley, sally hawkins","drama, foreign, romance, science fiction, thriller",103
the next three days,2010,paul haggis,"brian dennehy, elizabeth banks, liam neeson, olivia wilde, russell crowe, ty simpkins","crime, drama, thriller",133
night catches us,2010,tanya hamilton,"anthony mackie, kerry washington, tariq trotter, wendell pierce","drama, indie, romance",90
a nightmare on elm street,2010,samuel bayer,"clancy brown, jackie earle haley, katie cassidy, kellan lutz, kyle gallner, rooney mara, thomas dekker",horror,95
the other guys,2010,adam mckay,"derek jeter, eva mendes, mark wahlberg, michael keaton, will ferrell","action, adventure, comedy, crime",107
our family wedding,2010,rick famuyiwa,"america ferrera, carlos mencia, diana maria riva, forest whitaker, lance gross, regina king","comedy, romance",103
paranormal activity 2,2010,tod williams,"brian boland, katie featherston, micah sloat, molly ephraim, sprague grayden, vivis","horror, thriller",91
percy jackson & the olympians: the lightning thief,2010,chris columbus,"alexandra daddario, brandon t. jackson, catherine keener, kevin mckidd, logan lerman, pierce brosnan, rosario dawson, sean bean, steve coogan, uma thurman","adventure, drama, family, fantasy, mystery, science fiction",118
the perfect game,2010,william dear,"cheech marin, clifton collins jr., jake t. austin, louis gossett jr., moises arias, ricardo trevino, ryan ochoa","drama, family, sports film",118
please give,2010,nicole holofcener,"amanda peet, ann guilbert, catherine keener, oliver platt, rebecca hall, sarah steele","action, comedy, drama, indie, thriller",90
predators,2010,nimrod antal,"adrien brody, alice braga, danny trejo, laurence fishburne, oleg taktarov, topher grace, walton goggins","action, adventure, horror, science fiction",107
rabbit hole,2010,john cameron mitchell,"aaron eckhart, dianne wiest, nicole kidman, tammy blanchard","drama, indie",91
ramona and beezus,2010,elizabeth allen,"bridget moynahan, ginnifer goodwin, joey king, john corbett, sandra oh, selena gomez","adventure, comedy, family, fantasy",103
red,2010,robert schwentke,"brian cox, bruce willis, ernest borgnine, helen mirren, james remar, john malkovich, karl urban, mary-louise parker, morgan freeman, rebecca pidgeon, richard dreyfuss","action, adventure, comedy, crime, thriller",111
remember me,2010,allen coulter,"chris cooper, emilie de ravin, lena olin, pierce brosnan, robert pattinson, ruby jerins, tate ellington","drama, romance",113
repo men,2010,miguel sapochnik,"alice braga, carice van houten, chandler canterbury, forest whitaker, joe pingue, jude law, liev schreiber","action, adventure, science fiction, thriller",111
robin hood,2010,ridley scott,"cate blanchett, danny huston, max von sydow, oscar isaac, russell crowe","action, adventure, drama",140
the runaways,2010,floria sigismondi,"alia shawkat, brett cullen, dakota fanning, kristen stewart, michael shannon, riley keough, scout taylor-compton, stella maeve, tatum o'neal","drama, indie, music",106
saint john of las vegas,2010,hue rhodes,"emmanuelle chriqui, john cho, peter dinklage, romany malco, sarah silverman, steve buscemi, tim blake nelson","comedy, indie",84
salt,2010,phillip noyce,"andre braugher, angelina jolie, chiwetel ejiofor, daniel olbrychski, hunt block, liev schreiber","action, mystery, thriller",100
secretariat,2010,randall wallace,"diane lane, dylan walsh, fred dalton thompson, james cromwell, john malkovich, kevin connolly, nelsan ellis, nestor serrano, scott glenn","drama, family",123
sex and the city,2008,michael patrick king,"candice bergen, chris noth, cynthia nixon, david eigenberg, evan handler, jason lewis, jennifer hudson, kim cattrall, kristin davis, sarah jessica parker, willie garson","comedy, drama, romance",145
shutter island,2010,martin scorsese,"ben kingsley, jackie earle haley, leonardo dicaprio, mark ruffalo, max von sydow, michelle williams, ted levine","drama, mystery, thriller",138
skyline,2010,"colin strause, greg strause","brittany daniel, crystal reed, donald faison, eric balfour, scottie thompson","action, fantasy, mystery, sci-fi, science fiction, suspense, thriller",92
the social network,2010,david fincher,"andrew garfield, armie hammer, jesse eisenberg, justin timberlake, max minghella, rashida jones, rooney mara",drama,120
somewhere,2010,sofia coppola,"chris pontius, elle fanning, stephen dorff","drama, indie",98
splice,2010,vincenzo natali,"adrien brody, brandon mcgibbon, david hewlett, delphine chaneac, sarah polley","science fiction, thriller",104
the spy next door,2010,brian levant,"alina foley, amber valletta, billy ray cyrus, george lopez, jackie chan, madeline carroll, magnus scheving, will shadley","action, adventure, comedy, drama, family",94
stonewall,2015,roland emmerich,"andrea frankle, atticus mitchell, caleb landry jones, david cubitt, jeremy irvine, joanne vannicola, joey king, jonathan rhys-meyers, karl glusman, mark camacho, matt craven, ron perlman",drama,129
takers,2010,john luessenhop,"chris brown, hayden christensen, idris elba, matt dillon, paul walker","action, adventure, crime, drama, thriller",107
the tempest,2010,julie taymor,"alan cumming, ben whishaw, chris cooper, djimon hounsou, felicity jones, helen mirren, tom conti","drama, fantasy, science fiction",110
the town,2010,ben affleck,"ben affleck, blake lively, chris cooper, jeremy renner, jon hamm, pete postlethwaite, rebecca hall, titus welliver","action, crime, drama, romance, suspense, thriller",125
the tourist,2010,florian henckel,"angelina jolie, johnny depp, paul bettany, rufus sewell, steven berkoff, timothy dalton","action, mystery, romance, thriller",103
toy story 3,2010,lee unkrich,"don rickles, estelle harris, joan cusack, jodi benson, john morris, john ratzenberger, laurie metcalf, michael keaton, ned beatty, tim allen, timothy dalton, tom hanks, wallace shawn","animation, family",103
true grit,2010,"ethan coen, joel","barry pepper, hailee steinfeld, jeff bridges, josh brolin, matt damon","action, adventure, drama, western",110
unstoppable,2010,tony scott,"chris pine, denzel washington, ethan suplee, kevin dunn, rosario dawson","action, thriller",98
waiting for superman,2010,davis guggenheim,"anthony black, bianca hill, bill strickland, daisy esparza, geoffrey canada, michelle rhee",documentary,102
wall street: money never sleeps,2010,oliver stone,"austin pendleton, carey mulligan, eli wallach, frank langella, josh brolin, michael douglas, shia labeouf, susan sarandon","crime, drama",133
welcome to the rileys,2010,jake scott,"james gandolfini, joe chrest, kristen stewart, melissa leo","drama, indie",110
what if,2014,michael dowse,"adam driver, daniel radcliffe, mackenzie davis, megan park, rafe spall, zoe kazan","comedy, romance",102
winnebago man,2010,ben steinbauer,"alexsey vayner, douglas rushkoff, ghyslain raza, keith gordon","comedy, documentary, indie",85
adult beginners,2015,ross katz,"bobby cannavale, bobby moynihan, caitlin fitzgerald, jane krakowski, jason mantzoukas, joel mchale, josh charles, nick kroll, paula garcés, rose byrne",comedy,90
"crazy, stupid, love",2011,"glenn ficarra, john requa","analeigh tipton, beth littleford, emma stone, joey king, john carroll lynch, jonah bobo, julianne moore, kevin bacon, marisa tomei, ryan gosling, steve carell","comedy, drama, romance",118
learning to drive,2015,isabel coixet,"ben kingsley, grace gummer, jake weber, john hodgman, patricia clarkson, samantha bee, sarita choudhury","comedy, drama, romance",90
footloose,2011,craig brewer,"andie macdowell, dennis quaid, julianne hough, kenny wormald, miles teller, patrick john flueger, ray mckinnon","comedy, drama, family, music, romance",113
the future,2011,miranda july,"david warshofsky, hamish linklater, isabella acres, joe putterlik, miranda july","drama, indie",91
insidious chapter 3,2015,leigh whannell,"angus sampson, dermot mulroney, leigh whannell, lin shaye, stefanie scott, tate berney",horror,97
the muppets,2011,james bobin,"amy adams, chris cooper, jason segel, rashida jones, zach galifianakis","comedy, family, musical",103
paul blart: mall cop 2,2015,andy fickman,"d. b. woodside, daniella alonso, david henrie, eduardo verástegui, kevin james, neal mcdonough, nicholas turturro, raini rodriguez",comedy,94
restless,2011,gus van sant,"henry hopper, jane adams, lusia strus, mia wasikowska, ryo kase, schuyler fisk","drama, indie, romance",91
season of the witch,2011,dominic sena,"christopher lee, claire foy, nicolas cage, robert sheehan, ron perlman","action, adventure, drama, fantasy, science fiction, thriller",95
we bought a zoo,2011,cameron crowe,"angus macfadyen, colin ford, elle fanning, matt damon, patrick fugit, scarlett johansson, thomas haden church","comedy, drama, family",124
x-men: first class,2011,matthew vaughn,"caleb landry jones, james mcavoy, jennifer lawrence, kevin bacon, michael fassbender","action, adventure, drama, fantasy, sci-fi, science fiction",132
young adult,2011,jason reitman,"charlize theron, elizabeth reaser, jill eikenberry, mary beth hurt, patrick wilson, patton oswalt","comedy, drama, romance",94
zookeeper,2011,frank coraci,"donnie wahlberg, joe rogan, ken jeong, kevin james, leslie bibb, nat faxon, rosario dawson","comedy, family, romance",102
21,2008,robert luketic,"aaron yoo, jim sturgess, kate bosworth, kevin spacey, laurence fishburne, liza lapira","crime, drama",123
american teen,2008,nanette burstein,"ali wikalinska, colin clemens, geoff haase, hannah bailey",documentary,95
appaloosa,2008,ed harris,"ed harris, jeremy irons, lance henriksen, renee zellweger, timothy spall, viggo mortensen","action, drama, western",115
ballast,2008,lance hammer,"jimmyron ross, johnny mcphail, micheal j. smith, tarra riggs","action, documentary, drama, indie, thriller",96
bangkok dangerous,2008,oxide pang chun,"chakrit yamnarm, charlie yeung, james with, nicolas cage","action, adventure, crime, drama, mystery, suspense, thriller",99
be kind rewind,2008,michel gondry,"danny glover, jack black, melonie diaz, mia farrow, mos def, sigourney weaver",comedy,102
bedtime stories,2008,adam shankman,"adam sandler, courteney cox, guy pearce, jonathan morgan heit, keri russell, laura ann kesling, richard griffiths, russell brand","comedy, family, fantasy, science fiction",99
body of lies,2008,ridley scott,"golshifteh farahani, leonardo dicaprio, mark strong, oscar isaac, russell crowe, simon mcburney","action, adventure, drama, suspense, thriller",128
burn after reading,2008,"ethan, joel cohen","brad pitt, david rasche, frances mcdormand, george clooney, j.k. simmons, john malkovich, richard jenkins, tilda swinton","comedy, drama",96
cadillac records,2008,darnell martin,"adrien brody, beyonce knowles, cedric the entertainer, columbus short, eamonn walker, emmanuelle chriqui, gabrielle union, jeffrey wright, mos def","drama, history",109
changeling,2008,clint eastwood,"amy ryan, angelina jolie, colm feore, denis o'hare, geoff pierson, jeffrey donovan, john malkovich, michael kelly, reed birney","drama, mystery, thriller",141
choke,2008,clark gregg,"angelica huston, brian william henke, clark gregg, joel grey, kelly macdonald, sam rockwell","comedy, drama, indie",89
city of ember,2008,gil kenan,"bill murray, harry treadaway, marianne jean-baptiste, martin landau, mary kay place, saoirse ronan, tim robbins, toby jones","adventure, family, fantasy",90
cloverfield,2008,matt reeves,"jessica lucas, lizzy caplan, michael stahl-david, mike vogel, odette yustman, t.j. miller","action, horror, science fiction, thriller",85
the curious case of benjamin button,2008,david fincher,"brad pitt, cate blanchett, elias koteas, jason flemyng, julia ormond, taraji p. henson, tilda swinton","drama, fantasy, mystery, romance, science fiction, thriller",166
the day the earth stood still,2008,scott derrickson,"jaden smith, james hong, jennifer connelly, john cleese, jon hamm, kathy bates, keanu reeves","disaster, drama, science fiction, thriller",103
death race,2008,paul w.s. anderson,"ian mcshane, jason statham, joan allen, max ryan, natalie martinez, tyrese gibson","action, science fiction, thriller",105
deception,2008,marcel langenegger,"charlotte rampling, ewan mcgregor, hugh jackman, lisa gay hamilton, maggie q, michelle williams, natasha henstridge","crime, drama, mystery, romance, thriller",107
defiance,2009,edward zwick,"alexa davalos, allan corduner, daniel craig, jamie bell, liev schreiber","action, drama, history, war",137
doomsday,2015,neil johnson,"alain terzoli, amy pemberton, darren jacobs, richard lawrence","action, sci-fi",95
doubt,2008,john patrick shanley,"amy adams, joseph foster ii, meryl streep, philip seymour hoffman, viola davis","drama, mystery",104
eagle eye,2008,d.j. caruso,"anthony mackie, billy bob thornton, ethan embry, michael chilkis, michelle monaghan, rosario dawson, shia labeouf","action, mystery, thriller",118
elegy,2008,isabel coixet,"ben kingsley, deborah harry, dennis hopper, patricia clarkson, penelope cruz, peter sarsgaard","drama, romance",112
the express,2008,gary fleder,"charles s. dutton, darrin dewitt henson, dennis quaid, omar benson miller, rob brown",drama,130
fireflies in the garden,2011,dennis lee,"carrie-anne moss, emily watson, hayden panettiere, julia roberts, ryan reynolds, willem dafoe","drama, indie",108
flash of genius,2008,marc abraham,"alan alda, bill smitrovich, dermot mulroney, greg kinnear, jake abel, lauren graham",drama,119
the forbidden kingdom,2008,rob minkoff,"collin chou, jackie chan, jet li, michael angarano","action, adventure, fantasy",104
forgetting sarah marshall,2008,nicholas stoller,"bill hader, jason segel, jonah hill, kristen bell, mila kunis, paul rudd, russell brand","comedy, romance",111
four christmases,2008,seth gordon,"dwight yoakam, jon favreau, jon voight, kristin chenoweth, mary steenburgen, reese witherspoon, robert duvall, sissy spacek, tim mcgraw, vince vaughn","comedy, drama, romance",88
frost/nixon,2008,ron howard,"frank langella, kevin bacon, matthew macfadyen, michael sheen, oliver platt, patty mccormack, rebecca hall, sam rockwell, toby jones",drama,122
frozen river,2008,courtney hunt,"charlie mcdermott, james reilly, melissa leo, michael o'keefe, misty upham","crime, drama, thriller",97
funny games,2008,michael haneke,"brady corbet, devon gearhart, michael pitt, naomi watts, tim roth","mystery, suspense",111
get smart,2008,peter segal,"alan arkin, anne hathaway, dwayne johnson, james caan, patrick warburton, steve carell, terence stamp","action, adventure, comedy",110
ghost town,2008,david koepp,"billy campbell, dana ivey, greg kinnear, ricky gervais, tea leoni","comedy, romance",102
hamlet 2,2008,andrew fleming,"amy poehler, catherine keener, david arquette, elisabeth shue, joseph julian soria, shea pepe, skylar astin, steve coogan","comedy, music",92
hancock,2008,peter berg,"charlize theron, david mattey, eddie marsan, jae head, jason bateman, will smith","action, adventure, comedy, fantasy, thriller",92
the happening,2008,m. night shyamalan,"ashlyn sanchez, betty buckley, john leguizamo, mark wahlberg, spencer breslin, zooey deschanel","action, drama, mystery, science fiction, thriller",91
henry poole is here,2008,mark pellington,"adrianna barrazza, cheryl hines, george lopez, luke wilson, morgan lily, rachel seiferth, radha mitchell, richard benjamin","comedy, drama, indie",99
hero wanted,2008,brian smrz,"cuba gooding jr., kim coates, norman reedus, ray liotta, tommy flanagan","action, adventure, crime, drama, mystery, suspense",95
in bruges,2008,martin mcdonagh,"brendan gleeson, clemence poesy, colin farrell, jordan prentice, ralph fiennes","action, comedy, crime, drama, foreign, thriller",107
the incredible hulk,2008,louis leterrier,"edward norton, liv tyler, lou ferrigno, tim blake nelson, tim roth, william hurt","action, adventure, science fiction, thriller",114
indiana jones and the kingdom of the crystal skull,2008,steven spielberg,"cate blanchett, harrison ford, jim broadbent, john hurt, karen allen, shia lebeouf","action, adventure",122
inkheart,2009,iain softley,"andy serkis, brendan fraser, eliza hope bennett, helen mirren, jim broadbent, paul bettany","adventure, drama, family, fantasy, science fiction",106
journey to the center of the earth,2008,eric brevig,"anita briem, brendan fraser, cale boyter, josh hutcherson","action, adventure, family, fantasy, kids, science fiction",93
jumper,2008,doug liman,"dine lane, hayden christensen, jamie bell, michael rooker, rachel bison, samuel l. jackson","action, adventure, science fiction, thriller",88
lakeview terrace,2008,neil labute,"jay hernandez, kerry washington, patrick wilson, samuel l. jackson","drama, horror, suspense, thriller",110
last chance harvey,2009,joel hopkins,"dustin hoffman, eileen atkins, emma thompson, james brolin, kathy baker, liane balaban, richard schiff","comedy, drama, romance",92
leatherheads,2008,george clooney,"george clooney, john krasinski, jonathan pryce, renee zellweger, wayne duvall","comedy, romance",114
the love guru,2008,marco schnabel,"ben kingsley, jessica alba, justin timberlake, meagan good, mike myers, romany malco, stephen colbert, verne troyer","comedy, romance, sport",87
the longshots,2008,fred durst,"garrett morris, ice cube, jill marie jones, keke palmer, matt craven, tasha smith","drama, family",94
the lucky ones,2008,neil burger,"john heard, michael pena, rachel mcadams, tim robbins","comedy, drama, history, indie",113
mad money,2008,callie khouri,"adam rothenberg, christopher mcdonald, diane keaton, katie holmes, queen latifah, ted danson","action, comedy, crime",104
madagascar: escape 2 africa,2008,"eric darnell, tom mcgrath","alec baldwin, andy richter, ben stiller, bernie mac, cedric the entertainer, chris rock, david schwimmer, jada pinkett smith, sacha baron cohen, sherri shepherd, will.i.am","action, adventure, animation, family",89
mamma mia!,2008,phyllida lloyd,"amanda seyfried, christine baranski, colin firth, dominic cooper, julie walters, meryl streep, pierce brosnan, stellan skarsgard","comedy, music, romance",108
man on wire,2008,james marsh,"annie allix, ardis campbell, david demato, jean-louis blondeau, paul mcgill","documentary, indie",94
marley & me,2008,david frankel,"alan arkin, eric dane, jennifer aniston, kathleen turner, owen wilson","comedy, drama, family",115
max payne,2008,john moore,"beau bridges, chris ""ludacris"" bri..., mark wahlberg, mila kunis","action, adventure, crime, drama, mystery, suspense",100
never back down,2008,jeff wadlow,"amber heard, cam gigandet, djimon hounsou, evan peters, sean faris","action, adventure, drama, sport",113
nights in rodanthe,2008,george c. wolfe,"christopher meloni, diane lane, pablo schreiber, richard gere, scott glenn, viola davis","drama, romance",97
nothing like the holidays,2008,alfredo de villa,"alfred molina, debra messing, elizabeth pena, freddy rodriguez, jay hernandez, john leguizamo, luis guzman, melonie diaz","comedy, drama, indie, romance",98
the other boleyn girl,2008,justin chadwick,"eric bana, jim sturgess, kristin scott thomas, mark rylance, natalie portman, scarlett johansson","drama, foreign, history, romance",115
over her dead body,2008,jeff lowell,"eva longoria parker, jason biggs, lake bell, lindsay sloane, paul rudd, stephen root","comedy, romance",95
pineapple express,2008,david gordon green,"amber heard, bill hader, ed begley jr., gary cole, james franco, james remar, nora dunn, rosie perez, seth rogen","action, comedy",111
