Title,Year,Director,Cast,Genre,Duration
cecil b. demented,2000,john waters,"alicia witt, melanie griffith, stephen dorff","comedy, crime, thriller",87
center stage,2000,nicholas hytner,"amanda schull, ethan stiefel, sascha radetsky","drama, music, romance",115
charlie's angels,2000,mcg,"cameron diaz, drew barrymore, lucy liu","action, adventure, comedy, crime, thriller",98
cherry falls,2000,geoffrey wright,"brittany murphy, jay mohr, michael biehn","comedy, horror, mystery, thriller",92
chuck & buck,2000,miguel arteta,"chris weitz, lupe ontiveros, mike white","comedy, drama",96
the contender,2000,rod lurie,"gary oldman, jeff bridges, joan allen","drama, thriller",126
coyote ugly,2000,david mcnally,"adam garcia, john goodman, piper perabo","comedy, drama, music, romance",100
the crew,2000,michael dinner,"burt reynolds, dan hedaya, richard dreyfuss","comedy, crime",88
down to you,2000,kris isacsson,"freddie prinze jr., julia stiles, selma blair","comedy, drama, romance",91
drowning mona,2000,nick gomez,"bette midler, danny devito, neve campbell","comedy, crime, mystery",96
duets,2000,bruce paltrow,"gwyneth paltrow, huey lewis, paul giamatti","comedy, drama, music",112
dungeons & dragons,2000,courtney solomon,"jeremy irons, justin whalin, zoe mclellan","action, adventure, comedy, fantasy",107
erin brockovich,2000,steven soderbergh,"albert finney, david brisbin, julia roberts","biography, drama",131
an everlasting piece,2001,barry levinson,"anna friel, barry mcevoy, brían f. o'byrne",comedy,103
the eyes of tammy faye,2000,fenton bailey,"rupaul, tammy faye bakker, virginia fairchild","biography, documentary",79
the family man,2000,brett ratner,"don cheadle, nicolas cage, téa leoni","comedy, drama, fantasy, romance",125
final destination,2000,james wong,"ali larter, devon sawa, kerr smith","horror, thriller",98
the flintstones in viva rock vegas,2000,brian levant,"kristen johnston, mark addy, stephen baldwin","comedy, family, romance, sci-fi",90
frequency,2000,gregory hoblit,"dennis quaid, jim caviezel, shawn doyle","crime, drama, sci-fi, thriller",118
get carter,2000,stephen kay,"miranda richardson, rachael leigh cook, sylvester stallone","action, crime, drama, thriller",102
the gift,2015,joel edgerton,"allison tolman, beau knapp, busy philipps, david denman, jason bateman, joel edgerton, katie aselton, p. j. byrne, rebecca hall, wendell pierce","drama, horror, mystery, thriller",108
girlfight,2000,karyn kusama,"jaime tirelli, michelle rodriguez, santiago douglas","drama, sport",110
gladiator,2000,ridley scott,"connie nielsen, joaquin phoenix, russell crowe","action, drama",155
gone in sixty seconds,2000,dominic sena,"angelina jolie, giovanni ribisi, nicolas cage","action, crime, thriller",118
gun shy,2000,eric blakeney,"liam neeson, oliver platt, sandra bullock","comedy, crime, romance",101
hanging up,2000,diane keaton,"diane keaton, lisa kudrow, meg ryan","comedy, drama",94
held up,2000,steve rash,"barry corbin, jamie foxx, nia long",comedy,89
here on earth,2000,mark piznarski,"chris klein, josh hartnett, leelee sobieski","drama, romance",96
high fidelity,2000,stephen frears,"iben hjejle, john cusack, todd louiso","comedy, drama, music, romance",113
highlander: endgame,2000,douglas aarniokoski,"adrian paul, bruce payne, christopher lambert","action, adventure, fantasy, sci-fi",87
hollow man,2000,paul verhoeven,"elisabeth shue, josh brolin, kevin bacon","action, adventure, fantasy, horror, sci-fi, science fiction, thriller",112
i dreamed of africa,2000,hugh hudson,"kim basinger, liam aiken, vincent perez","adventure, drama, romance",114
ivansxtc,2002,bernard rose,"danny huston, james merendino, peter weller",drama,93
the in crowd,2000,mary lambert,"lori heuring, matthew settle, susan ward","drama, mystery, thriller",105
joe gould's secret,2000,stanley tucci,"hope davis, ian holm, stanley tucci",drama,104
keeping the faith,2000,edward norton,"ben stiller, edward norton, jenna elfman","comedy, drama, romance",128
the ladies man,2000,reginald hudlin,"billy dee williams, karyn parsons, tim meadows",comedy,84
legacy,2015,davie fairbanks,"amy tyger, franz drameh, mckell david","comedy, drama",95
the legend of bagger vance,2000,robert redford,"charlize theron, matt damon, will smith","drama, fantasy, sport",126
little nicky,2000,steven brill,"adam sandler, harvey keitel, patricia arquette","comedy, fantasy",90
the little vampire,2000,uli edel,"jonathan lipnicki, richard e. grant, rollo weeks","adventure, comedy, family, fantasy",95
loser,2000,amy heckerling,"jason biggs, mena suvari, zak orth","comedy, romance",98
lost souls,2000,janusz kaminski,"ben chaplin, sarah wynter, winona ryder","drama, horror, thriller",97
love & basketball,2000,gina prince-bythewood,"glenndon chatman, omar epps, sanaa lathan","drama, romance, sport",124
lucky numbers,2000,nora ephron,"john travolta, lisa kudrow, tim roth","comedy, crime",105
maryam,2002,ramin serry,"david ackert, mariam parris, shaun toub",drama,87
meet the parents,2000,jay roach,"ben stiller, robert de niro, teri polo",comedy,108
meet the fockers,2004,jay roach,"ben stiller, blythe danner, robert de niro","comedy, romance",115
men of honor,2000,george tillman jr.,"charlize theron, cuba gooding jr., robert de niro","biography, drama",129
mercy streets,2000,jon gunn,"cynthia watros, david a.r. white, eric roberts","action, crime, drama",106
the million dollar hotel,2000,wim wenders,"jeremy davies, mel gibson, milla jovovich","drama, mystery, thriller",122
miss congeniality,2000,donald petrie,"benjamin bratt, michael caine, sandra bullock","action, comedy, crime",109
mission to mars,2000,brian de palma,"don cheadle, gary sinise, tim robbins","adventure, drama, sci-fi, thriller",114
mission: impossible ii,2000,john woo,"dougray scott, thandie newton, tom cruise","action, adventure, thriller",123
my dog skip,2000,jay russell,"diane lane, frankie muniz, kevin bacon","drama, family, sport",95
my 5 wives,2000,sidney j. furie,"andrew dice clay, john byner, rodney dangerfield",comedy,100
the next best thing,2000,john schlesinger,"benjamin bratt, madonna, rupert everett","comedy, drama, romance",108
nothin' 2 lose,2000,barry bowles,"brian hooks, cedric pendleton, shani bayeté","comedy, romance",98
nurse betty,2000,neil labute,"chris rock, morgan freeman, renée zellweger","comedy, crime, drama",110
the opportunists,2000,myles connell,"anne pitoniak, christopher walken, peter mcdonald","comedy, crime, drama, romance",90
the original kings of comedy,2000,spike lee,"cedric the entertainer, d.l. hughley, steve harvey","comedy, documentary",115
our song,2001,jim mckay,"anna simpson, kerry washington, melissa martinez",drama,95
passion of mind,2000,alain berliner,"demi moore, eloise eonnet, hadrian dagannaud-brouard","drama, mystery, romance, sci-fi, thriller",105
the patriot,2000,roland emmerich,"heath ledger, joely richardson, mel gibson","action, drama, history, war",165
pay it forward,2000,mimi leder,"haley joel osment, helen hunt, kevin spacey",drama,123
the perfect storm,2000,wolfgang petersen,"diane lane, george clooney, mark wahlberg","action, adventure, drama, thriller",130
picking up the pieces,2000,alfonso arau,"angélica aragón, david schwimmer, woody allen","comedy, fantasy",95
pitch black,2000,david twohy,"cole hauser, radha mitchell, vin diesel","action, horror, sci-fi",109
poor white trash,2000,michael addis,"sean young, tony denman, william devane","comedy, crime",85
price of glory,2000,carlos ávila,"jimmy smits, jon seda, maria del mar","drama, sport",118
prince of central park,2000,john leekley,"cathy moriarty, danny aiello, kathleen turner","action, adventure, drama",109
proof of life,2000,taylor hackford,"david morse, meg ryan, russell crowe","action, drama, thriller",135
quills,2000,philip kaufman,"geoffrey rush, joaquin phoenix, kate winslet","biography, drama",124
ready to rumble,2000,brian robbins,"david arquette, oliver platt, scott caan","comedy, sport",107
red planet,2000,antony hoffman,"carrie-anne moss, tom sizemore, val kilmer","action, fantasy, mystery, sci-fi, science fiction, suspense, thriller",106
reindeer games,2000,john frankenheimer,"ben affleck, charlize theron, gary sinise","action, crime, drama, thriller",104
remember the titans,2000,boaz yakin,"denzel washington, will patton, wood harris","biography, drama, sport",113
the replacements,2000,howard deutch,"brooke langton, gene hackman, keanu reeves","comedy, sport",118
requiem for a dream,2000,darren aronofsky,"ellen burstyn, jared leto, jennifer connelly",drama,102
return to me,2000,bonnie hunt,"carroll o'connor, david duchovny, minnie driver","comedy, drama, romance",115
the road to el dorado,2000,bibo bergeron,"kenneth branagh, kevin kline, rosie perez","adventure, animation, comedy, family, romance",89
road trip,2000,todd phillips,"amy smart, breckin meyer, seann william scott",comedy,93
romeo must die,2000,andrzej bartkowiak,"aaliyah, isaiah washington, jet li","action, crime, thriller",115
17 again,2009,burr steers,"brian doyle-murray, hunter parrish, leslie mann, matthew perry, melora hardin, michelle trachtenberg, sterling knight, thomas lennon, zac efron","comedy, drama, family, fantasy, romance",102
shaft,2000,john singleton,"christian bale, samuel l. jackson, vanessa williams","action, crime, thriller",99
shanghai noon,2000,tom dey,"jackie chan, lucy liu, owen wilson","action, adventure, comedy, western",110
the skulls,2000,rob cohen,"hill harper, joshua jackson, paul walker","action, crime, drama, horror, mystery, suspense, thriller",106
small time crooks,2000,woody allen,"hugh grant, tracey ullman, woody allen","comedy, crime",94
snatch.,2001,guy ritchie,"benicio del toro, brad pitt, jason statham","comedy, crime",102
snow day,2000,chris koch,"chevy chase, chris elliott, schuyler fisk","adventure, comedy, family",89
songcatcher,2001,maggie greenwald,"janet mcteer, michael goodwin, michael q. davis","drama, music",109
sound and fury,2000,josh aronson,"chris artinian, freeda cat, jaime leigh allen, jemma braham, scott davidson",documentary,80
space cowboys,2000,clint eastwood,"clint eastwood, donald sutherland, tommy lee jones","action, adventure, thriller",130
the specials,2000,craig mazin,"paget brewster, rob lowe, thomas haden church","action, comedy, fantasy, sci-fi",82
the tao of steve,2000,jenniphr goodman,"ayelet kaznelson, donal logue, john hines","comedy, drama, romance",87
things you can tell just by looking at her,2000,rodrigo garcía,"calista flockhart, cameron diaz, glenn close","drama, romance",109
the tigger movie,2000,jun falkenstein,"jim cummings, ken sansom, nikita hopkins","animation, comedy, drama, family",77
timecode,2000,mike figgis,"jeanne tripplehorn, salma hayek, stellan skarsgård",drama,97
titanic,1997,james cameron,"billy zane, kate winslet, leonardo dicaprio","drama, romance",194
tripfall,2000,serge rodnunsky,"eric roberts, john ritter, rachel hunter","drama, mystery, suspense, thriller",91
turn it up,2000,robert adetuyi,"ja rule, jason statham, pras michel","action, crime, drama, music",86
u-571,2000,jonathan mostow,"bill paxton, harvey keitel, matthew mcconaughey","action, war",116
under suspicion,2000,stephen hopkins,"gene hackman, morgan freeman, thomas jane","crime, drama, thriller",110
up at the villa,2000,philip haas,"anne bancroft, kristin scott thomas, sean penn","drama, romance",115
urban legends: final cut,2000,john ottman,"hart bochner, jennifer morrison, matthew davis","horror, mystery, thriller",97
vertical limit,2000,martin campbell,"bill paxton, chris o'donnell, scott glenn","action, adventure, drama, thriller",124
the visit,2015,m. night shyamalan,"benjamin kanes, deanna dunagan, ed oxenbould, kathryn hahn, olivia dejonge, peter mcrobbie","comedy, horror, thriller",94
the watcher,2000,joe charbanic,"james spader, keanu reeves, marisa tomei","crime, horror, mystery, thriller",97
the way of the gun,2000,christopher mcquarrie,"benicio del toro, juliette lewis, ryan phillippe","action, crime, drama, thriller",119
what lies beneath,2000,robert zemeckis,"harrison ford, katharine towne, michelle pfeiffer","drama, horror, mystery, thriller",130
what planet are you from?,2000,mike nichols,"annette bening, garry shandling, john goodman","comedy, sci-fi",105
whatever it takes,2000,david raynr,"jodi lyn o'keefe, marla sokoloff, shane west","comedy, drama, romance",94
where the heart is,2000,matt williams,"ashley judd, james frain, natalie portman","comedy, drama, romance",120
where the money is,2000,marek kanievska,"dermot mulroney, linda fiorentino, paul newman","comedy, crime, drama",89
the whole nine yards,2000,jonathan lynn,"bruce willis, matthew perry, rosanna arquette","comedy, crime",98
woman on top,2000,fina torres,"anne ramsey, harold perrineau, murilo benício, penélope cruz","comedy, fantasy, romance",92
wonder boys,2000,curtis hanson,"frances mcdormand, michael douglas, tobey maguire","comedy, drama",107
the yards,2000,james gray,"charlize theron, joaquin phoenix, mark wahlberg","crime, drama, romance, thriller",115
you can count on me,2000,kenneth lonergan,"laura linney, mark ruffalo, matthew broderick",drama,111
15 minutes,2001,john herzfeld,"edward burns, kelsey grammer, robert de niro","action, crime, drama, thriller",120
3000 miles to graceland,2001,demian lichtenstein,"courteney cox, kevin costner, kurt russell","action, comedy, crime, thriller",125
a.i. artificial intelligence,2001,steven spielberg,"brendan gleeson, frances o'connor, haley joel osment, jude law, sam robards, william hurt","adventure, drama, horror, sci-fi, science fiction",145
the affair of the necklace,2001,charles shyer,"hilary swank, jonathan pryce, simon baker","drama, history, romance",118
perfume: the story of a murderer,2007,tom tykwer,"alan rickman, ben whishaw, david calder, dustin hoffman, john hurt, karoline herfurth, rachel hurd-wood","crime, drama, fantasy, foreign",147
snowpiercer,2014,joon-ho bong,"alison pill, chris evans, ewen bremner, jamie bell, john hurt, octavia spencer, tilda swinton","action, drama, sci-fi, science fiction, thriller",126
planet of the apes,2001,tim burton,"helena bonham carter, mark wahlberg, tim roth","action, adventure, sci-fi",119
the pledge,2001,sean penn,"aaron eckhart, benicio del toro, helen mirren, jack nicholson, mickey rourke, patricia clarkson, robin wright penn, sam shepard","crime, drama, mystery, thriller",124
pootie tang,2001,louis c.k.,"chris rock, j.b. smoove, lance crouther","action, adventure, comedy, musical",81
the princess diaries,2001,garry marshall,"anne hathaway, hector elizondo, julie andrews","comedy, family, romance",115
rat race,2001,jerry zucker,"amy smart, breckin meyer, whoopi goldberg","adventure, comedy",112
recess: school's out,2001,chuck sheetz,"andrew lawrence, jason davis, rickey d'shon collins","animation, comedy, family, mystery, sci-fi",82
riding in cars with boys,2001,penny marshall,"adam garcia, drew barrymore, steve zahn","biography, comedy, drama",132
rock star,2001,stephen herek,"dominic west, jennifer aniston, mark wahlberg","comedy, drama, music",105
the royal tenenbaums,2002,wes anderson,"anjelica huston, gene hackman, gwyneth paltrow","comedy, drama",110
the score,2001,frank oz,"edward norton, marlon brando, robert de niro","action, crime, romance, thriller",124
rush hour 2,2001,brett ratner,"chris tucker, jackie chan, john lone","action, comedy, crime, mystery, thriller",90
rush hour 3,2007,brett ratner,"chris tucker, dana ivey, jackie chan, max von sydow, roman polanski, yvan attal","action, adventure, comedy, crime, thriller",91
rush hour,1998,brett ratner,"chris tucker, elizabeth pea, jackie chan, ken leung, tom wilkinson","action, adventure, comedy, crime",97
save the last dance,2001,thomas carter,"julia stiles, kerry washington, sean patrick thomas","drama, music, romance",112
saving silverman,2001,dennis dugan,"jack black, jason biggs, steve zahn","comedy, crime, romance",90
scary movie 2,2001,keenen ivory wayans,"anna faris, antony acker, marlon wayans","comedy, horror",83
see spot run,2001,john whitesell,"david arquette, leslie bibb, michael clarke duncan","action, comedy, crime, family",94
serendipity,2001,peter chelsom,"jeremy piven, john cusack, kate beckinsale","comedy, romance",90
session 9,2001,brad anderson,"david caruso, paul guilfoyle, stephen gevedon","horror, mystery, thriller",97
the shrink is in,2001,richard benjamin,"courteney cox, david arquette, david james elliott","comedy, romance",92
sidewalks of new york,2001,edward burns,"edward burns, heather graham, penny balfour","comedy, romance",108
someone like you...,2001,tony goldwyn,"ashley judd, greg kinnear, hugh jackman","comedy, romance",97
southern comfort,1981,walter hill,"fred ward, keith carradine, powers boothe","action, thriller",106
spy game,2001,tony scott,"brad pitt, catherine mccormack, robert redford","action, crime, thriller",126
sugar & spice,2001,francine mcdougall,"marla sokoloff, marley shelton, melissa george","comedy, crime",81
summer catch,2001,michael tollin,"fred ward, freddie prinze jr., jessica biel","comedy, drama, romance, sport",108
super troopers,2002,jay chandrasekhar,"andré vippolis, brian cox, daniel von bargen, jay chandrasekhar, kevin heffernan, lynda carter, marisa coughlan","comedy, crime, mystery",100
sweet november,2001,pat o'connor,"charlize theron, jason isaacs, keanu reeves","drama, romance",119
swordfish,2001,dominic sena,"halle berry, hugh jackman, john travolta","action, crime, thriller",99
the tailor of panama,2001,john boorman,"geoffrey rush, jamie lee curtis, pierce brosnan","drama, thriller",109
tomcats,2001,gregory poirier,"jake busey, jerry o'connell, shannon elizabeth",comedy,95
tortilla soup,2001,maria ripoll,"hector elizondo, jacqueline obradors, tamara mello","comedy, drama, romance",102
training day,2001,antoine fuqua,"denzel washington, ethan hawke, scott glenn","crime, drama, thriller",122
two can play that game,2001,mark brown,"anthony anderson, morris chestnut, vivica a. fox","comedy, romance",90
valentine,2001,jamie blanks,"david boreanaz, denise richards, marley shelton","horror, thriller",96
waking life,2001,richard linklater,"ethan hawke, lorelei linklater, trevor jack brooks","animation, drama, fantasy, indie",99
when strangers appear,2002,scott reynolds,"barry watson, josh lucas, radha mitchell","action, mystery, thriller",98
13 going on 30,2004,gary winick,"jennifer garner, judy greer, mark ruffalo","comedy, fantasy, romance",98
50 first dates,2004,peter segal,"adam sandler, drew barrymore, rob schneider","comedy, romance",99
after the sunset,2004,brett ratner,"pierce brosnan, salma hayek, woody harrelson","action, comedy, crime, drama",97
against the ropes,2004,charles s. dutton,"charles s. dutton, meg ryan, omar epps","biography, drama, romance, sport",111
agent cody banks 2: destination london,2004,kevin allen,"anthony anderson, frankie muniz, hannah spearritt","action, adventure, comedy, family, romance, sci-fi",100
the alamo,2004,john lee hancock,"billy bob thornton, dennis quaid, emilio echevarría","drama, history, war, western",137
alexander,2004,oliver stone,"anthony hopkins, colin farrell, rosario dawson","action, adventure, biography, drama, history, romance, war",175
alfie,2004,charles shyer,"jude law, sienna miller, susan sarandon","comedy, drama, romance",103
along came polly,2004,john hamburg,"ben stiller, debra messing, jennifer aniston","comedy, romance",90
around the world in 80 days,2004,frank coraci,"jackie chan, jim broadbent, steve coogan","action, adventure, comedy",120
the assassination of richard nixon,2004,niels mueller,"don cheadle, naomi watts, sean penn","biography, drama",95
the aviator,2004,martin scorsese,"cate blanchett, kate beckinsale, leonardo dicaprio","biography, drama",170
before sunset,2004,richard linklater,"ethan hawke, julie delpy, vernon dobtcheff","drama, romance",80
before midnight,2013,richard linklater,"ethan hawke, julie delpy","comedy, drama, romance",108
the best thief in the world,2004,jacob kornbluth,"david warshofsky, mary-louise parker, michael silverman","comedy, drama",93
beyond the sea,2004,kevin spacey,"john goodman, kate bosworth, kevin spacey","biography, drama, musical",118
the big bounce,2004,george armitage,"gary sinise, morgan freeman, owen wilson","comedy, crime",88
the blue butterfly,2004,léa pool,"marc donato, pascale bussières, william hurt","adventure, drama",97
book of love,2004,alan brown,"frances o'connor, gregory smith, simon baker","comedy, drama",83
the bourne supremacy,2004,paul greengrass,"franka potente, joan allen, matt damon","action, thriller",108
brother to brother,2004,rodney evans,"anthony mackie, duane boutte, lawrence gilliard jr.",drama,94
the butterfly effect,2004,eric bress,"amy smart, ashton kutcher, melora walters","drama, fantasy, mystery, sci-fi, science fiction, suspense, thriller",113
catch that kid,2004,bart freundlich,"jennifer beals, kristen stewart, sam robards","action, adventure, comedy, crime, family, kids",91
catwoman,2004,pitof,"benjamin bratt, halle berry, sharon stone",action,104
cellular,2004,david r. ellis,"chris evans, jason statham, kim basinger","action, crime, drama, thriller",94
chasing liberty,2004,andy cadiff,"mandy moore, mark harmon, matthew goode","comedy, romance",111
christmas with the kranks,2004,joe roth,"dan aykroyd, jamie lee curtis, tim allen","comedy, family",99
the chronicles of riddick,2004,david twohy,"colm feore, judi dench, vin diesel","action, adventure, sci-fi, thriller",119
riddick,2013,david twohy,"bokeem woodbine, dave bautista, jordi mollà, karl urban, katee sackhoff, neil napier, noah danby, nolan gerard funk, vin diesel","action, science fiction, thriller",119
a cinderella story,2004,mark rosman,"chad michael murray, hilary duff, jennifer coolidge","comedy, family, romance",95
the clearing,2004,pieter jan brugge,"helen mirren, robert redford, willem dafoe","drama, mystery, thriller",95
club dread,2004,jay chandrasekhar,"bill paxton, jay chandrasekhar, kevin heffernan","comedy, horror, thriller",104
collateral,2004,michael mann,"jada pinkett smith, jamie foxx, tom cruise","crime, drama, thriller",120
confessions of a teenage drama queen,2004,sara sugarman,"adam garcia, lindsay lohan, megan fox","comedy, family, music, romance",89
connie and carla,2004,michael lembeck,"david duchovny, nia vardalos, toni collette","comedy, crime, music",98
control room,2004,jehane noujaim,"george w. bush, josh rushing, samir khader",documentary,84
the cookout,2004,lance rivera,"ja rule, jenifer lewis, quran pender",comedy,97
dawn of the dead,2004,zack snyder,"mekhi phifer, sarah polley, ving rhames","action, horror, sci-fi, thriller",101
the day after tomorrow,2004,roland emmerich,"dennis quaid, emmy rossum, jake gyllenhaal","action, adventure, sci-fi, thriller",124
a day without a mexican,2004,sergio arau,"caroline aaron, john getz, maureen flannigan, melinda allen, muse watson, tony abatemarco, yareli arizmendi","comedy, drama, fantasy, mystery",100
dirty dancing: havana nights,2004,guy ferland,"diego luna, romola garai, sela ward","drama, romance",86
a dirty shame,2004,john waters,"chris isaak, selma blair, tracey ullman",comedy,89
the door in the floor,2004,tod williams,"jeff bridges, jon foster, kim basinger","comedy, drama",111
drum,1976,steve carver,"isela vega, ken norton, warren oates","action, drama",110
ella enchanted,2004,tommy o'haver,"anne hathaway, cary elwes, hugh dancy","comedy, family, fantasy, romance",96
envy,2004,barry levinson,"ben stiller, jack black, rachel weisz",comedy,99
eternal sunshine of the spotless mind,2004,michel gondry,"david cross, elijah wood, gerry robert byrne, jane adams, jim carrey, kate winslet, kirsten dunst, mark ruffalo, thomas jay ryan, tom wilkinson","comedy, drama, fantasy, romance, sci-fi, science fiction",108
fahrenheit 9/11,2004,michael moore,"ben affleck, george w. bush, michael moore",documentary,122
fat albert,2004,joel zwick,"kenan thompson, kyla pratt, omarion grandberry","comedy, family, fantasy, romance",93
finding neverland,2004,marc forster,"johnny depp, julie christie, kate winslet","biography, drama, family",106
the final cut,2004,omar naim,"jim caviezel, mira sorvino, robin williams","action, drama, fantasy, mystery, sci-fi, science fiction, suspense, thriller",95
first daughter,2004,forest whitaker,"katie holmes, marc blucas, michael keaton","comedy, drama, romance",106
flight of the phoenix,2004,john moore,"dennis quaid, giovanni ribisi, miranda otto","action, adventure, drama, thriller",113
forty shades of blue,2005,ira sachs,"darren e. burrows, dina korzun, jenny o''hara, paprika steen, red west, rip torn","drama, indie, music, romance",108
the girl next door,2004,luke greenfield,"elisha cuthbert, emile hirsch, nicholas downs","comedy, drama, romance",108
hair show,2004,leslie small,"gina torres, kellita smith, mo'nique","comedy, romance",105
harry potter and the prisoner of azkaban,2004,alfonso cuarón,"daniel radcliffe, emma watson, rupert grint","adventure, family, fantasy, mystery",142
hellboy,2004,guillermo del toro,"doug jones, ron perlman, selma blair","action, fantasy, sci-fi",122
hellboy ii: the golden army,2008,guillermo del toro,"anna walton, doug jones, jeffrey tambor, john alexander/james dodd, luke goss, ron perlman, selma blair","action, adventure, comedy, fantasy, science fiction, thriller",120
hidalgo,2004,joe johnston,"omar sharif, viggo mortensen, zuleikha robinson","action, adventure, western",136
highwaymen,2004,robert harmon,"frankie faison, jim caviezel, rhona mitra","action, crime, thriller",80
i heart huckabees,2004,david o. russell,"jason schwartzman, jude law, naomi watts",comedy,107
imaginary heroes,2005,dan harris,"emile hirsch, jeff daniels, sigourney weaver","comedy, drama",111
the incredibles,2004,brad bird,"craig t. nelson, holly hunter, samuel l. jackson","action, adventure, animation, family",115
