ID,Title,Year,Director,Cast,Genre,Duration
3179,Tunay na tunay: Gets mo? Gets ko!,2000,Joyce Bernal,"Robin Padilla, Jolina Magdangal, Vic Diaz","Action, Comedy, Romance",106 min 
3180,Ang dalubhasa,2000,Fernando Poe Jr.,"Fernando Poe Jr., Nanette Medved, Maritoni Fernandez","Action, Drama",115 min 
3181,Palaban,2000,Toto Natividad,"Rudy Fernandez, Ara Mina, Roi Vinzon","Action, Drama",105 min 
3182,Orpheus & Eurydice,2000,Paul Pissanos,"Andrew Bullock, David Bowles, Carolina Liriti","Action, Adventure, Drama",124 min 
3183,One Piece: The Movie,2000,Atsuji Shimizu,"Akemi Okamura, Kappei Yamaguchi, Kazuya Nakai","Animation, Action, Adventure",51 min 
3184,Sangharsh,1999,Tanuja Chandra,"Akshay Kumar, Preity Zinta, Ashutosh Rana","Action, Crime, Thriller",127 min 
3185,Jimmy Zip,1999,Robert McGinley,"Brendan Fletcher, Ike Gingrich, Rosemary Welden","Action, Crime, Drama",112 min 
3186,Three Kings,1999,David O. Russell,"George Clooney, Mark Wahlberg, Ice Cube","Action, Adventure, Comedy",114 min 
3187,Virus,1999,John Bruno,"Jamie Lee Curtis, William Baldwin, Donald Sutherland","Action, Horror, Thriller",99 min 
3188,Beowulf,1999,Graham Baker,"Christopher Lambert, Rhona Mitra, Oliver Cotton","Action, Adventure, Fantasy",95 min 
3189,The Mummy,1999,Stephen Sommers,"Brendan Fraser, Rachel Weisz, John Hannah","Action, Adventure, Fantasy",125 min 
3190,The Mod Squad,1999,Scott Silver,"Claire Danes, Omar Epps, Giovanni Ribisi","Action, Crime, Thriller",92 min 
3191,One Man's Hero,1999,Lance Hool,"Tom Berenger, Joaquim de Almeida, Daniela Romo","Action, Drama, History",121 min 
3192,Payback,1999,Brian Helgeland,"Mel Gibson, Gregg Henry, Maria Bello","Action, Crime, Drama",100 min 
3193,Wild Wild West,1999,Barry Sonnenfeld,"Will Smith, Kevin Kline, Kenneth Branagh","Action, Western, Comedy",106 min 
3194,Tail Lights Fade,1999,Malcolm Ingram,"Jaimz Woolvett, Breckin Meyer, Jake Busey","Comedy, Action, Drama",87 min 
3195,Hidden Agenda,1999,Iain Paterson,"Kevin Dillon, Andrea Roth, J.T. Walsh","Action, Crime, Mystery",101 min 
3196,Facade,1999,Carl Colpaert,"Eric Roberts, Camilla Overbye Roos, Angus Macfadyen","Action, Thriller",93 min 
3197,The Iron Giant,1999,Brad Bird,"Eli Marienthal, Harry Connick Jr., Jennifer Aniston","Animation, Action, Adventure",86 min 
3198,Wing Commander,1999,Chris Roberts,"Freddie Prinze Jr., Matthew Lillard, Saffron Burrows","Action, Adventure, Sci-Fi",100 min 
3199,Mystery Men,1999,Kinka Usher,"Ben Stiller, Janeane Garofalo, William H. Macy","Action, Comedy, Fantasy",121 min 
3200,Plunkett & Macleane,1999,Jake Scott,"Robert Carlyle, Jonny Lee Miller, Iain Robertson","Action, Adventure, Crime",99 min 
3201,Road Kill,1999,Matthew Leutwyler,"Jennifer Rubin, Erik Palladino, Billy Jayne","Action, Comedy, Drama",92 min 
3202,Entrapment,1999,Jon Amiel,"Sean Connery, Catherine Zeta-Jones, Ving Rhames","Action, Crime, Romance",113 min 
3203,Taxman,1999,Avi Nesher,"Joe Pantoliano, Wade Dominguez, Elizabeth Berkley","Action, Crime, Comedy",104 min 
3204,Desert Heat,1999,John G. Avildsen,"Jean-Claude Van Damme, Pat Morita, Danny Trejo","Action, Drama, Romance",95 min 
3205,Inspector Gadget,1999,David Kellogg,"Matthew Broderick, Rupert Everett, Joely Fisher","Action, Adventure, Comedy",78 min 
3206,The Corruptor,1999,James Foley,"Yun-Fat Chow, Mark Wahlberg, Ric Young","Action, Crime, Drama",110 min 
3207,The World Is Not Enough,1999,Michael Apted,"Pierce Brosnan, Sophie Marceau, Robert Carlyle","Action, Adventure, Thriller",128 min 
3208,The Boondock Saints,1999,Troy Duffy,"Willem Dafoe, Sean Patrick Flanery, Norman Reedus","Action, Crime, Thriller",108 min 
3209,Austin Powers: The Spy Who Shagged Me,1999,Jay Roach,"Mike Myers, Heather Graham, Michael York","Action, Adventure, Comedy",95 min 
3210,End of Days,1999,Peter Hyams,"Arnold Schwarzenegger, Gabriel Byrne, Robin Tunney","Action, Fantasy, Horror",121 min 
3211,Deep Blue Sea,1999,Renny Harlin,"Thomas Jane, Saffron Burrows, Samuel L. Jackson","Action, Sci-Fi, Thriller",105 min 
3212,Black and White,1999,Yuri Zeltser,"Gina Gershon, Rory Cochrane, Ron Silver","Action, Mystery, Thriller",97 min 
3213,Fallout,1999,Rodney McDonald,"Daniel Baldwin, Frank Zagarino, Teri Ann Linn","Action, Sci-Fi",90 min 
3214,The Prophet,1999,Fred Olen Ray,"Don 'The Dragon' Wilson, Barbara Steele, Alexander Keith",Action,83 min 
3215,The Vivero Letter,1999,H. Gordon Boos,"Robert Patrick, Chiara Caselli, Fred Ward","Action, Adventure, Thriller",95 min 
3216,The Criminal,1999,Julian Simpson,"Steven Mackintosh, Bernard Hill, Eddie Izzard","Action, Drama",99 min 
3217,The Debt Collector,1999,Anthony Neilson,"Billy Connolly, Ken Stott, Francesca Annis","Action, Crime, Thriller",109 min 
3218,Shepherd,1999,Peter Hayman,"C. Thomas Howell, Roddy Piper, David Carradine","Action, Sci-Fi",86 min 
3219,Angel's Dance,1999,David L. Corley,"James Belushi, Sheryl Lee, Kyle Chandler","Action, Comedy, Crime",99 min 
3220,Chill Factor,1999,Hugh Johnson,"Cuba Gooding Jr., Skeet Ulrich, Peter Firth","Action, Adventure, Comedy",102 min 
3221,Desert Thunder,1999,Jim Wynorski,"Tim Abell, Daniel Baldwin, Ari Barak","Action, Drama",90 min 
3222,Ghost Dog: The Way of the Samurai,1999,Jim Jarmusch,"Forest Whitaker, Henry Silva, John Tormey","Action, Crime, Drama",116 min 
3223,Restraining Order,1999,Lee H. Katzin,"Eric Roberts, Hannes Jaenicke, Tatjana Patitz","Action, Thriller",95 min 
3224,Hijack,1999,Worth Keeter,"Jeff Fahey, Ernie Hudson, Beth Toussaint","Action, Thriller",94 min 
3225,Interceptor Force,1999,Phillip J. Roth,"Olivier Gruner, Brad Dourif, Ernie Hudson","Action, Drama, Sci-Fi",97 min 
3226,The Last Marshal,1999,Mike Kirton,"Scott Glenn, Constance Marie, Randall Batinkoff","Action, Thriller",102 min 
3227,Simon Sez,1999,Kevin Alyn Elders,"Dennis Rodman, Dane Cook, John Pinette","Action, Comedy",85 min 
3228,Final Voyage,1999,Jim Wynorski,"Dylan Walsh, Ice-T, Erika Eleniak","Action, Drama",95 min 
3229,Straight Shooter,1999,Thomas Bohn,"Dennis Hopper, Heino Ferch, Katja Flint","Crime, Drama, Thriller",88 min 
3230,Airspeed,1999,Robert Tinnell,"Elisha Cuthbert, Bronwen Booth, Joe Mantegna","Adventure, Action, Drama",93 min 
3231,Diplomatic Siege,1999,Gustavo Graef Marino,"Peter Weller, Daryl Hannah, Tom Berenger","Action, Thriller",90 min 
3232,Traitor's Heart,1999,Danny Lerner,"Bryan Genesse, Kimberley Kates, Ron Smerczak",Action,91 min 
3233,Bloodsport: The Dark Kumite,1999,Elvis Restaino,"Daniel Bernhardt, Ivan Ivanov, Lisa Stothard","Action, Romance",100 min 
3234,Free Fall,1999,Mario Azzopardi,"Hannes Jaenicke, Jaclyn Smith, Bruce Boxleitner","Action, Drama",89 min 
3235,Paradise Mall,1999,Friedemann Fromm,"Ken Duken, Heiner Lauterbach, Franka Potente","Drama, Action",114 min 
3236,Hitman's Run,1999,Mark L. Lester,"Eric Roberts, Esteban Powell, C. Thomas Howell",Action,93 min 
3237,New World Disorder,1999,Richard Spence,"Rutger Hauer, Tara Fitzgerald, Andrew McCarthy",Action,94 min 
3238,Enemy Action,1999,Brian Katkin,"C. Thomas Howell, Louis Mandylor, Lisa Thornhill","Action, Drama",84 min 
3239,Made Men,1999,Louis Morneau,"James Belushi, Michael Beach, Timothy Dalton","Action, Comedy, Thriller",91 min 
3240,Universal Soldier: The Return,1999,Mic Rodgers,"Jean-Claude Van Damme, Bill Goldberg, Heidi Schanz","Action, Sci-Fi",83 min 
3241,Escape Velocity,1999,Lloyd A. Simandl,"Wendy Crewson, Patrick Bergin, Peter Outerbridge","Action, Sci-Fi",100 min 
3242,Gigantics,1999,Sebastian Schipper,"Frank Giering, Florian Lukas, Antoine Monot Jr.","Comedy, Drama, Romance",80 min 
3243,The Glass Agency,1999,Ebrahim Hatamikia,"Parviz Parastui, Reza Kianian, Habib Rezaei","Action, Drama, Romance",114 min 
3244,The Life Before This,1999,Jerry Ciccoritti,"Catherine O'Hara, Joe Pantoliano, Sarah Polley","Action, Crime, Drama",92 min 
3245,Third World Cop,1999,Chris Browne,"Paul Campbell, Mark Danvers, Carl Bradshaw","Action, Drama, Thriller",98 min 
3246,Storm Catcher,1999,Anthony Hickox,"Dolph Lundgren, Mystro Clark, Jon Pennell","Action, Thriller",95 min 
3247,In China They Eat Dogs,1999,Lasse Spang Olsen,"Kim Bodnia, Dejan Cukic, Nikolaj Lie Kaas","Action, Comedy, Crime",91 min 
3248,Avalanche,1999,Steve Kroschel,"Thomas Ian Griffith, Caroleen Feeney, R. Lee Ermey","Action, Thriller",96 min 
3249,Blue Streak,1999,Les Mayfield,"Martin Lawrence, Luke Wilson, Peter Greene","Action, Comedy, Crime",93 min 
3250,The Item,1999,Dan Clark,"DawnMarie Ferrara, Dan Clark, Dave Pressler","Action, Horror",100 min 
3251,Stealth Fighter,1999,Jim Wynorski,"Ice-T, Costas Mandylor, Erika Eleniak","Action, Drama",88 min 
3252,Gorgeous,1999,Vincent Kok,"Jackie Chan, Qi Shu, Tony Chiu Wai Leung","Action, Comedy, Drama",121 min 
3253,Pups,1999,Ash Baron-Cohen,"Mischa Barton, Cameron Van Hoy, Burt Reynolds","Action, Crime, Drama",99 min 
3254,Do Not Disturb,1999,Dick Maas,"William Hurt, Jennifer Tilly, Francesca Brown","Action, Thriller, Comedy",94 min 
3255,Silicon Towers,1999,Serge Rodnunsky,"Daniel Baldwin, Kendall Clement, Brian Dennehy","Action, Thriller, Drama",87 min 
3256,Godzilla 2000,1999,Takao Okawara,"Hiroshi Abe, Naomi Nishida, Takehiro Murata","Action, Adventure, Drama",99 min 
3257,Murdercycle,1999,Tom Callaway,"Charles Wesley, Cassandra Ellis, Robert Donavan","Action, Sci-Fi",90 min 
3258,No Tomorrow,1999,Master P,"Gary Busey, Gary Daniels, Master P","Action, Thriller",99 min 
3259,The Witness Files,1999,Douglas Jackson,"Yancy Butler, David Nerman, Barry Flatman","Action, Crime, Drama",95 min 
3260,Swiri,1999,Je-kyu Kang,"Suk-kyu Han, Min-sik Choi, Yunjin Kim","Action, Crime, Drama",125 min 
3261,Teenage Space Vampires,1999,Martin Wood,"Robin Dunne, Mac Fyfe, James Kee","Action, Sci-Fi",90 min 
3262,Turbulence 2: Fear of Flying,1999,David Mackay,"Craig Sheffer, Tom Berenger, Jennifer Beals","Action, Thriller",101 min 
3263,Bridge of Dragons,1999,Isaac Florentine,"Dolph Lundgren, Cary-Hiroyuki Tagawa, Valerie Chow","Action, Romance, Sci-Fi",92 min 
3264,Corrupt,1999,Albert Pyun,"Silkk Tha Shocker, Ice-T, Tarsha Nicole Jones","Action, Crime, Drama",69 min 
3265,Operation Delta Force 4: Deep Fault,1999,Mark Roper,"Greg Collins, Joe Lara, Justin Williams",Action,96 min 
3266,Y2K,1999,Richard Pepin,"Louis Gossett Jr., Jaimz Woolvett, Ed O'Ross","Action, Thriller",106 min 
3267,Zero Tolerance,1999,Anders Nilsson,"Jakob Eklund, Peter Andersson, Marie Richardson","Action, Crime, Thriller",108 min 
3268,Sarfarosh,1999,John Mathew Matthan,"Naseeruddin Shah, Aamir Khan, Sonali Bendre","Action, Adventure, Drama",174 min 
3269,VS3: Infantry of Doom,1999,Andreas Schnaas,"Andreas Schnaas, Marc Trinkhaus, Steve Aquilina","Action, Horror",85 min 
3270,The Omega Code,1999,Robert Marcarelli,"Casper Van Dien, Michael York, Catherine Oxenberg","Action, Adventure, Fantasy",100 min 
3271,A Man Called Hero,1999,Wai-Keung Lau,"Ekin Cheng, Qi Shu, Kristy Yang","Action, Adventure, Drama",116 min 
3272,Gen-X Cops,1999,Benny Chan,"Nicholas Tse, Stephen Fung, Sam Lee","Action, Thriller, Comedy",114 min 
3273,Random Acts of Violence,1999,Drew Bell,"Esteban Powell, Alex Solowitz, Brian Klugman","Action, Crime",77 min 
3274,Pokemon: Power of One,1999,Michael Haigney,"Rica Matsumoto, Madeleine Blaustein, Mayumi Iizuka","Animation, Action, Adventure",99 min 
3275,Baadshah,1999,Abbas Alibhai Burmawalla,"Rakhee Gulzar, Shah Rukh Khan, Twinkle Khanna","Action, Comedy, Musical",175 min 
3276,Bullets Over Summer,1999,Wilson Yip,"Louis Koo, Francis Ng, Matt Chow","Action, Crime, Romance",92 min 
3277,Thakshak,1999,Govind Nihalani,"Ajay Devgn, Tabu, Amrish Puri","Crime, Drama, Action",163 min 
3278,Running Out of Time,1999,Johnnie To,"Andy Lau, Ching Wan Lau, YoYo Mung","Action, Crime, Drama",93 min 
3279,Shool,1999,Eeshwar Nivas,"Manoj Bajpayee, Raveena Tandon, Sayaji Shinde","Action, Crime, Drama",138 min 
3280,Vaastav: The Reality,1999,Mahesh Manjrekar,"Sanjay Dutt, Namrata Shirodkar, Mohnish Bahl","Action, Adventure, Crime",145 min 
3281,Nowhere to Hide,1999,Myung-se Lee,"Joong-Hoon Park, Sung-kee Ahn, Dong-gun Jang","Action, Comedy, Crime",112 min 
3282,The Victim,1999,Ringo Lam,"Tony Ka Fai Leung, Ching Wan Lau, Amy Kwok","Action, Crime, Horror",90 min 
3283,Phantom: The Submarine,1999,Byung-chun Min,"Min-su Choi, Woo-sung Jung, Kyung-gu Sol","Action, Thriller",110 min 
3284,Purple Storm,1999,Teddy Chan,"Daniel Wu, Kwok-Leung Gan, Emil Chau",Action,112 min 
3285,The Legend of Speed,1999,Wai-Keung Lau,"Ekin Cheng, Cecilia Cheung, Moses Chan","Action, Thriller",109 min 
3286,Cetverored,1999,Jakov Sedlar,"Ivan Marevich, Ena Begovic, Goran Navojec","Action, Drama, War",123 min 
3287,Revolutionary Girl Utena: The Movie,1999,Kunihiko Ikuhara,"Tomoko Kawakami, Yuriko Fuchizaki, Leah Applebaum","Animation, Action, Adventure",100 min 
3288,The Killing Zone,1999,Ian David Diaz,"Julian Boote, Paul Vates, Mark Bowden","Thriller, Action",92 min 
3289,Warat,1999,Joel Lamangan,"Jomari Yllana, Joyce Jimenez, Joko Diaz","Action, Drama",110 min 
3290,Muro-ami,1999,Marilou Diaz-Abaya,"Cesar Montano, Pen Medina, Jhong Hilario","Action, Drama, Adventure",120 min 
3291,Haseena Maan Jaayegi,1999,David Dhawan,"Sanjay Dutt, Govinda, Karisma Kapoor","Comedy, Action, Drama",147 min 
3292,Reptile 2001,1999,Hyung-rae Shim,"Dan Cashman, Bruce Cornwell, Dennis Howard","Action, Horror, Fantasy",99 min 
3293,Lethal Target,1999,Lloyd A. Simandl,"C.C. Costigan, Josh Barker, Kim Sill","Action, Sci-Fi",92 min 
3294,Alyas Pogi: Ang pagbabalik,1999,Joey Del Rosario,"Ramon 'Bong' Revilla Jr., Ara Mina, Tonton Gutierrez","Action, Drama",111 min 
3295,Suspek,1999,Toto Natividad,"Victor Neri, Sharmaine Arnaiz, Emilio Garcia","Action, Drama",143 min 
3296,Maa Kasam,1999,Ashok Gaekwad,,Action,132 min 
3297,Champions,1998,Peter Gathings Bunche,"Louis Mandylor, Danny Trejo, Ken Shamrock",Action,99 min 
3298,3 Ninjas: High Noon at Mega Mountain,1998,Sean McNamara,"Loni Anderson, Hulk Hogan, Jim Varney","Action, Adventure, Comedy",93 min 
3299,American Dragons,1998,Ralph Hemecker,"Michael Biehn, Joong-Hoon Park, Cary-Hiroyuki Tagawa","Action, Crime",91 min 
3300,The Avengers,1998,Jeremiah S. Chechik,"Ralph Fiennes, Uma Thurman, Sean Connery","Action, Adventure, Sci-Fi",89 min 
3301,Black Thunder,1998,Rick Jacobson,"Marcus Aurelius, Catherine Bell, Michael Cavanaugh","Action, Drama",85 min 
3302,Six-String Samurai,1998,Lance Mungia,"Jeffrey Falcon, Justin McGuire, Kim De Angelo","Action, Adventure, Comedy",91 min 
3303,Blues Brothers 2000,1998,John Landis,"Dan Aykroyd, John Goodman, Walter Levine","Action, Comedy, Crime",123 min 
3304,A Brooklyn State of Mind,1998,Frank Rainone,"Vincent Spano, Maria Grazia Cucinotta, Danny Aiello","Action, Crime, Drama",89 min 
3305,Operation Delta Force 3: Clear Target,1998,Mark Roper,"Jim Fitzpatrick, Bryan Genesse, Greg Collins",Action,94 min 
3306,Deadly Ransom,1998,Robert Hyatt,"Loren Avedon, Lisa K. Crosato, Brion James",Action,92 min 
3307,Deep Rising,1998,Stephen Sommers,"Treat Williams, Famke Janssen, Anthony Heald","Action, Adventure, Horror",106 min 
3308,Desperate Measures,1998,Barbet Schroeder,"Michael Keaton, Andy Garcia, Brian Cox","Action, Crime, Drama",100 min 
3309,Fallen,1998,Gregory Hoblit,"Denzel Washington, John Goodman, Donald Sutherland","Action, Crime, Drama",124 min 
3310,Freedom Strike,1998,Jerry P. Jacobs,"Michael Dudikoff, Tone Loc, Felicity Waterman","Drama, Action",93 min 
3311,1 chance sur 2,1998,Patrice Leconte,"Jean-Paul Belmondo, Alain Delon, Vanessa Paradis","Action, Adventure, Comedy",104 min 
3312,Commander Hamilton,1998,Harald Zwart,"Peter Stormare, Lena Olin, Mark Hamill","Action, Adventure, Crime",127 min 
3313,McCinsey's Island,1998,Sam Firstenberg,"Hulk Hogan, Grace Jones, Robert Vaughn","Action, Adventure, Comedy",95 min 
3314,Montana,1998,Jennifer Leitzes,"Kyra Sedgwick, Stanley Tucci, Robin Tunney","Action, Comedy, Crime",96 min 
3315,The Replacement Killers,1998,Antoine Fuqua,"Yun-Fat Chow, Mira Sorvino, Michael Rooker","Action, Crime, Drama",87 min 
3316,Shelter,1998,Scott Paulin,"John Allen Nelson, Brenda Bakke, Peter Onorati","Action, Thriller",92 min 
3317,Soldier,1998,Paul W.S. Anderson,"Kurt Russell, Jason Scott Lee, Jason Isaacs","Action, Drama, Sci-Fi",99 min 
3318,Spoiler,1998,Jeff Burr,"Gary Daniels, Meg Foster, Bryan Genesse","Action, Sci-Fi",90 min 
3319,The Stringer,1998,Pawel Pawlikowski,"Sergey Bodrov Jr., Anna Friel, Vladimir Ilin","Action, Drama, Romance",88 min 
3320,Surface to Air,1998,Rodney McDonald,"Michael Madsen, Chad McQueen, Melanie Shatner","Action, War",93 min 
3321,Termination Man,1998,Fred Gallo,"Steve Railsback, James Farentino, Athena Massey","Action, Drama",92 min 
3322,Armageddon,1998,Michael Bay,"Bruce Willis, Billy Bob Thornton, Ben Affleck","Action, Adventure, Sci-Fi",151 min 
3323,The Big Hit,1998,Kirk Wong,"Mark Wahlberg, Lou Diamond Phillips, Christina Applegate","Action, Comedy, Crime",91 min 
3324,Black Dog,1998,Kevin Hooks,"Patrick Swayze, Randy Travis, Meat Loaf","Action, Crime, Drama",89 min 
3325,Blade,1998,Stephen Norrington,"Wesley Snipes, Stephen Dorff, Kris Kristofferson","Action, Horror",120 min 
3326,Enemy of the State,1998,Tony Scott,"Will Smith, Gene Hackman, Jon Voight","Action, Crime, Drama",132 min 
3327,Firestorm,1998,Dean Semler,"Howie Long, Scott Glenn, William Forsythe","Thriller, Action",89 min 
3328,Godzilla,1998,Roland Emmerich,"Matthew Broderick, Jean Reno, Maria Pitillo","Action, Sci-Fi, Thriller",139 min 
3329,Hard Rain,1998,Mikael Salomon,"Morgan Freeman, Christian Slater, Randy Quaid","Action, Crime, Drama",97 min 
3330,Knock Off,1998,Hark Tsui,"Jean-Claude Van Damme, Rob Schneider, Lela Rochon","Action, Comedy, Thriller",91 min 
3331,Lost in Space,1998,Stephen Hopkins,"Gary Oldman, William Hurt, Matt LeBlanc","Action, Adventure, Family",130 min 
3332,The Man in the Iron Mask,1998,Randall Wallace,"Leonardo DiCaprio, Jeremy Irons, John Malkovich","Action, Adventure",132 min 
3333,The Mask of Zorro,1998,Martin Campbell,"Antonio Banderas, Anthony Hopkins, Catherine Zeta-Jones","Action, Adventure, Comedy",136 min 
3334,Mercury Rising,1998,Harold Becker,"Bruce Willis, Miko Hughes, Alec Baldwin","Action, Crime, Drama",111 min 
3335,Mighty Joe Young,1998,Ron Underwood,"Bill Paxton, Charlize Theron, Rade Serbedzija","Action, Adventure, Family",114 min 
3336,The Negotiator,1998,F. Gary Gray,"Samuel L. Jackson, Kevin Spacey, David Morse","Action, Crime, Drama",140 min 
3337,The Newton Boys,1998,Richard Linklater,"Matthew McConaughey, Ethan Hawke, Skeet Ulrich","Action, Crime, Drama",113 min 
3338,The Patriot,1998,Dean Semler,"Steven Seagal, L.Q. Jones, Gailard Sartain","Action, Thriller",90 min 
3339,Rush Hour,1998,Brett Ratner,"Jackie Chan, Chris Tucker, Ken Leung","Action, Comedy, Crime",98 min 
3340,Six Days Seven Nights,1998,Ivan Reitman,"Harrison Ford, Anne Heche, David Schwimmer","Action, Adventure, Comedy",98 min 
3341,Snake Eyes,1998,Brian De Palma,"Nicolas Cage, Gary Sinise, John Heard","Action, Crime, Drama",98 min 
3342,Star Trek: Insurrection,1998,Jonathan Frakes,"Patrick Stewart, Jonathan Frakes, Brent Spiner","Action, Adventure, Sci-Fi",103 min 
3343,Sweepers,1998,Keoni Waxman,"Dolph Lundgren, Bruce Payne, Claire Stansfield","Action, Adventure, Drama",96 min 
3344,Tarzan and the Lost City,1998,Carl Schenkel,"Casper Van Dien, Jane March, Steven Waddington","Action, Adventure, Family",83 min 
3345,U.S. Marshals,1998,Stuart Baird,"Tommy Lee Jones, Wesley Snipes, Robert Downey Jr.","Action, Crime, Thriller",131 min 
3346,Vampires,1998,John Carpenter,"James Woods, Daniel Baldwin, Sheryl Lee","Action, Horror, Thriller",108 min 
3347,Wrongfully Accused,1998,Pat Proft,"Leslie Nielsen, Richard Crenna, Kelly LeBrock","Action, Comedy, Thriller",87 min 
3348,Lethal Weapon 4,1998,Richard Donner,"Mel Gibson, Danny Glover, Joe Pesci","Action, Crime, Thriller",127 min 
3349,One Tough Cop,1998,Bruno Barreto,"Stephen Baldwin, Chris Penn, Gina Gershon","Action, Crime",90 min 
3350,Ronin,1998,John Frankenheimer,"Robert De Niro, Jean Reno, Natascha McElhone","Action, Adventure, Crime",122 min 
3351,Small Soldiers,1998,Joe Dante,"Kirsten Dunst, Gregory Smith, David Cross","Action, Adventure, Comedy",110 min 
3352,Arrival II,1998,Kevin Tenney,"Patrick Muldoon, Jane Sibbett, Michael Sarrazin","Action, Adventure, Sci-Fi",101 min 
3353,Thursday,1998,Skip Woods,"Thomas Jane, Aaron Eckhart, Paulina Porizkova","Action, Crime, Drama",87 min 
3354,Renegade Force,1998,Martin Kunert,"Michael Rooker, Robert Patrick, Diane DiLascio","Action, Thriller",90 min 
3355,Legionnaire,1998,Peter MacDonald,"Jean-Claude Van Damme, Adewale Akinnuoye-Agbaje, Steven Berkoff","Action, Adventure, Drama",99 min 
3356,Who Am I?,1998,Benny Chan,"Jackie Chan, Michelle Ferre, Mirai Yamamoto","Action, Adventure, Comedy",108 min 
3357,Recoil,1998,Art Camacho,"Gary Daniels, Gregory McKinney, Thomas Kopache",Action,96 min 
3358,No Code of Conduct,1998,Bret Michaels,"Charlie Sheen, Martin Sheen, Mark Dacascos","Action, Crime, Drama",95 min 
3359,The Siege,1998,Edward Zwick,"Denzel Washington, Bruce Willis, Annette Bening","Action, Thriller",116 min 
3360,A Murder of Crows,1998,Rowdy Herrington,"Cuba Gooding Jr., Tom Berenger, Marianne Jean-Baptiste","Action, Crime, Thriller",102 min 
3361,Butter,1998,Peter Gathings Bunche,"Shemar Moore, Nia Long, Ernie Hudson","Action, Thriller",101 min 
3362,Provocateur,1998,Jim Donovan,"Jane March, Stephen Mendel, Lillo Brancato","Action, Drama, Thriller",103 min 
3363,Ground Control,1998,Richard Howard,"Kiefer Sutherland, Robert Sean Leonard, Bruce McGill","Action, Adventure, Drama",93 min 
3364,The Sender,1998,Richard Pepin,"Michael Madsen, R. Lee Ermey, Robert Vaughn","Action, Sci-Fi",98 min 
3365,Ambushed,1998,Ernest R. Dickerson,"Courtney B. Vance, Jeremy Lelliott, Virginia Madsen","Action, Thriller",109 min 
3366,Armstrong,1998,Menahem Golan,"Kimberley Kates, Frank Zagarino, Charles Napier","Action, Drama",99 min 
3367,Naked Lies,1998,Ralph E. Portillo,"Shannon Tweed, Fernando Allende, Jay Baker","Action, Crime, Drama",93 min 
3368,In God's Hands,1998,Zalman King,"Matt George, Matty Liu, Shane Dorian","Action, Drama, Sport",96 min 
3369,Killing Time,1998,Bharat Nalluri,"Craig Fairbrass, Nigel Leach, Kendra Torgan","Action, Crime, Thriller",88 min 
3370,Unlucky Monkey,1998,SABU,"Shin'ichi Tsutsumi, Hiroshi Shimizu, Akira Yamamoto","Action, Comedy",106 min 
3371,Hell Mountain,1998,Mike Rohl,"Nicole Nieth, Bentley Mitchum, Sarah Douglas","Action, Drama, Horror",94 min 
3372,Loyal Opposition,1998,Mark Sobel,"Joan Van Ark, Nick Mancuso, Rick Springfield","Action, Drama, Thriller",120 min 
3373,The White Raven,1998,Jakub Z. Rucinski,"Ron Silver, Joanna Pacula, Roy Scheider","Action, Crime, Thriller",92 min 
3374,Stuart Bliss,1998,Neil Grieve,"Michael Zelniker, Dea Lawrence, Derek McGrath","Action, Drama, Thriller",88 min 
3375,Legacy,1998,T.J. Scott,"David Hasselhoff, Donita Rose, Rod Steiger",Action,105 min 
3376,Beast Cops,1998,Gordon Chan,"Anthony Chau-Sang Wong, Michael Wong, Stephanie Che","Action, Crime, Drama",110 min 
3377,Dead End,1998,Douglas Jackson,"Eric Roberts, Jacob Tierney, Eliza Roberts","Action, Drama, Thriller",93 min 
3378,Pau mui,1998,Clarence Yiu-leung Fok,"Michael Wong, Almen Pui-Ha Wong, Ben Lam","Action, Romance",86 min 
3379,Whatever It Takes,1998,Brady MacKenzie,"Don 'The Dragon' Wilson, Andrew Dice Clay, Fred Williamson",Action,101 min 
3380,Ballistic Kiss,1998,Donnie Yen,"Donnie Yen, Annie Wu, Jimmy Ga Lok Wong","Action, Drama, Thriller",92 min 
3381,98 goo waak chai ji lung chang foo dau,1998,Wai-Keung Lau,"Ekin Cheng, Qi Shu, Kar Lok Chin",Action,114 min 
3382,Contract Killer,1998,Wei Tung,"Jet Li, Eric Tsang, Simon Yam","Action, Comedy",104 min 
3383,Duplicate,1998,Mahesh Bhatt,"Kajol, Shah Rukh Khan, Juhi Chawla","Action, Comedy, Crime",164 min 
3384,The Pandora Project,1998,John Terlesky,"Daniel Baldwin, Erika Eleniak, Richard Tyson","Action, Thriller",89 min 
3385,The Storm Riders,1998,Wai-Keung Lau,"Aaron Kwok, Ekin Cheng, Shin'ichi Chiba","Action, Adventure, Fantasy",128 min 
3386,A True Mob Story,1998,Jing Wong,"Andy Lau, Gigi Leung, Suki Kwan","Action, Crime, Drama",112 min 
3387,Running Woman,1998,Rachel Samuels,"Theresa Russell, Andrew Robinson, Anthony Crivello",Action,87 min 
3388,The Longest Nite,1998,Tat-Chi Yau,"Ching Wan Lau, Tony Chiu Wai Leung, Maggie Siu","Action, Crime, Drama",81 min 
3389,San goo waak chai ji siu nin gik dau pin,1998,Wai-Keung Lau,"Nicholas Tse, Francis Ng, Qi Shu","Action, Drama",117 min 
3390,Samehada otoko to momojiri onna,1998,Katsuhito Ishii,"Tadanobu Asano, Ittoku Kishibe, Sie Kohinata","Mystery, Action, Thriller",108 min 
3391,And Now You're Dead,1998,Corey Yuen,"Shannon Lee, Michael Wong, Anita Yuen",Action,95 min 
3392,Major Saab,1998,Tinnu Anand,"Amitabh Bachchan, Ajay Devgn, Sonali Bendre","Action, Drama, Romance",165 min 
3393,Point Blank,1998,Matt Earl Beesley,"Mickey Rourke, Danny Trejo, Frederic Forrest","Action, Crime, Drama",89 min 
3394,Amazon Warrior,1998,Dennis Devine,"J.J. Rodgers, Raymond Storti, Jimmy Jerman","Action, Sci-Fi",83 min 
3395,The Process,1998,Ernie Reyes Jr.,"Ernie Reyes Jr., Corin Nemec, Ernie Reyes Sr.",Action,90 min 
3396,The Ultimate Weapon,1998,Jon Cassar,"Hulk Hogan, Carl Marotte, Cynthia Preston",Action,110 min 
3397,Satya,1998,Ram Gopal Varma,"J.D. Chakravarthi, Urmila Matondkar, Paresh Rawal","Action, Crime, Drama",170 min 
3398,Shanghai Affairs,1998,Donnie Yen,,"Action, Drama, Romance",90 min 
3399,Bandhan,1998,K. Muralimohana Rao,"Jackie Shroff, Salman Khan, Rambha","Action, Drama, Romance",154 min 
3400,Ben Delubyo,1998,Ike Jarlego Jr.,,"Action, Drama",89 min 
3401,Pagbabalik ng probinsyano,1998,Fernando Poe Jr.,"Fernando Poe Jr., Anjanette Abayari, Paquito Diaz","Drama, Action",123 min 
3402,Dand Nayak,1998,Sikander Bharti,,Action,153 min 
3403,Gunda,1998,Kanti Shah,"Mithun Chakraborty, Verna Raj, Ishrat Ali","Action, Comedy, Crime",129 min 
3404,Mard,1998,Ganpati Bohra,,Action,135 min 
