ID,Title,Year,Director,Cast,Genre,Duration
a2072,day of the falcon,2013,jean-jacques annaud,"tahar rahim, antonio banderas, mark strong","adventure, drama",130
a2073,blind dating,2007,james keach,"chris pine, anjali jay, eddie kaye thomas","comedy, romance",95
a2074,blood diamond,2006,edward zwick,"leonardo dicaprio, djimon hounsou, jennifer connelly","adventure, drama, thriller",143
a2075,blood tea and red string,2006,christiane cegavske,,"animation, fantasy",71
a2076,bloody mary 3d,2011,charlie vaughn,"veronica ricci, alena savostikova, derek jameson",horror,82
a2077,bobby,2006,emilio estevez,"anthony hopkins, demi moore, sharon stone","drama, history",117
a2078,borat: cultural learnings of america for make benefit glorious nation of kazakhstan,2006,larry charles,"sacha baron cohen, ken davitian, luenell",comedy,84
a2079,brand upon the brain! a remembrance in 12 chapters,2008,guy maddin,"gretchen krich, sullivan brown, maya lawson","comedy, fantasy",95
a2080,breaking and entering,2006,anthony minghella,"jude law, robin wright, vera farmiga","drama, romance",120
a2081,break up,1998,paul marcus,"kiefer sutherland, bridget fonda, hart bochner",thriller,100
a2082,the breed,2007,nicholas mastandrea,"michelle rodriguez, oliver hudson, taryn manning","comedy, horror, thriller",91
a2083,broken bridges,2006,steven goldmann,"brian f. durkin, jason leith, richard tillman","drama, music",105
a2084,busgirl,2006,steven schuldt,"jessie pridemore, stephen steelman, leah diamond ii",drama,82
a2085,caffeine,2007,john cosgrove,"marsha thomason, mena suvari, callum blue",comedy,92
a2086,cars,2006,john lasseter,"owen wilson, bonnie hunt, paul newman","animation, adventure, comedy, family, sport",117
a2087,casino royale,2006,martin campbell,"daniel craig, eva green, judi dench","action, adventure, thriller",144
a2088,catch a fire,2006,phillip noyce,"derek luke, tim robbins, bonnie henna","biography, drama, history",101
a2089,the cats of mirikitani,2007,linda hattendorf,"linda hattendorf, jimmy mirikitani",documentary,74
a2090,chalk,2007,mike akel,"troy schremmer, janelle schremmer, shannon haragan","comedy, drama",85
a2091,charlotte's web,2006,gary winick,"dakota fanning, julia roberts, oprah winfrey","comedy, family, fantasy",97
a2092,chasing the horizon,2006,markus canter,"milo brown, jeff lloyd, toby o'mara","documentary, adventure, comedy, drama",88
a2093,children of men,2007,alfonso cuarón,"julianne moore, clive owen, chiwetel ejiofor","drama, sci-fi, thriller",109
a2094,christmas at maxwell's,2006,william c. laufer,"andrew may, jack hourigan, helen welch",drama,94
a2095,church ball,2006,kurt hale,"andrew wilson, amy stewart, clint howard","comedy, sport",91
a2096,civic duty,2008,jeff renfroe,"peter krause, khaled abol naga, richard schiff","drama, thriller",98
a2097,clear cut: the story of philomath oregon,2006,peter richardson,,documentary,72
a2098,clerks ii,2006,kevin smith,"brian o'halloran, jeff anderson, rosario dawson",comedy,97
a2099,click,2006,frank coraci,"adam sandler, kate beckinsale, christopher walken","comedy, drama, fantasy, romance",107
a2100,cocaine cowboys,2007,billy corben,"jon roberts, al sunshine, sam burstyn","documentary, crime",118
a2101,coffee date,2006,stewart wade,"jonathan bray, wilson cruz, jonathan silverman","comedy, romance",94
a2102,color of the cross,2006,jean-claude la marre,"jean-claude la marre, johann john jean, adam green",drama,108
a2103,come early morning,2007,joey lauren adams,"ashley judd, jeffrey donovan, tim blake nelson","drama, romance",97
a2104,the contract,2007,bruce beresford,"john cusack, morgan freeman, jamie anderson","action, crime, drama, thriller",96
a2105,copying beethoven,2007,agnieszka holland,"ed harris, diane kruger, matthew goode","biography, drama, music",104
a2106,the covenant,2006,renny harlin,"steven strait, sebastian stan, toby hemingway","action, fantasy, horror, thriller",97
a2107,crank,2006,mark neveldine,"jason statham, amy smart, carlos sanz","action, crime, thriller",88
a2108,crossover,2006,preston a. whitmore ii,"anthony mackie, wesley jonathan, wayne brady","action, sport",95
a2109,crude impact,2006,james jandak wood,"thom hartmann, william rees, richard heinberg","documentary, history",97
a2110,curious george,2006,matthew o'callaghan,"will ferrell, drew barrymore, eugene levy","animation, adventure, comedy, family",86
a2111,the curiosity of chance,2006,russell p. marleau,"tad hilgenbrink, brett chukerman, aldevina da silva",comedy,98
a2112,the da vinci code,2006,ron howard,"tom hanks, audrey tautou, jean reno","mystery, thriller",149
a2114,danika,2006,ariel vromen,"marisa tomei, hannah marks, guy camilleri","drama, horror, mystery, thriller",79
a2115,danny roane: first time director,2006,andy dick,"eddie alfano, jamie anne allman, bob bancroft",comedy,83
a2116,dark corners,2006,ray gower,"thora birch, toby stephens, christien anholt","horror, thriller",92
a2117,dark ride,2006,craig singer,"jamie-lynn sigler, patrick renna, david clayton rogers","horror, thriller",94
a2118,the darwin awards,2006,finn taylor,"joseph fiennes, winona ryder, david arquette","adventure, comedy, romance",94
a2119,date movie,2006,aaron seltzer,"alyson hannigan, fred willard, jennifer coolidge","comedy, romance",83
a2121,day night day night,2007,julia loktev,"luisa williams, josh philip weinstein, gareth saxe","crime, drama, thriller",94
a2122,day on fire,2007,jay anania,"richard bright, carmen chaplin, martin donovan",drama,91
a2123,the dead girl,2007,karen moncrieff,"toni collette, brittany murphy, marcia gay harden","crime, drama, mystery",85
a2124,the death of poe,2006,mark redfield,"mark redfield, kevin g. shinnick, jennifer rouse","drama, horror",80
a2125,dã©jã  vu,1998,henry jaglom,"victoria foyt, stephen dillane, vanessa redgrave","drama, romance",117
a2126,deck the halls,2006,john whitesell,"matthew broderick, danny devito, kristin chenoweth","comedy, family",93
a2127,deliver us from evil,2014,scott derrickson,"eric bana, ã‰dgar ramã­rez, olivia munn","crime, horror, mystery, thriller",118
a2128,the departed,2006,martin scorsese,"leonardo dicaprio, matt damon, jack nicholson","crime, drama, thriller",151
a2129,the devil and daniel johnston,2006,jeff feuerzeig,"daniel johnston, mabel johnston, bill johnston","documentary, biography, music",110
a2130,the devil wears prada,2006,david frankel,"anne hathaway, meryl streep, adrian grenier","comedy, drama, romance",109
a2131,diggers,2007,katherine dieckmann,"paul rudd, ken marino, maura tierney","comedy, drama",96
a2132,disappearances,2006,jay craven,"kris kristofferson, charlie mcdermott, gary farmer","action, adventure, drama",118
a2133,shut up & sing,2006,barbara kopple,"natalie maines, emily robison, martie maguire","documentary, biography, music",93
a2134,doa: dead or alive,2007,corey yuen,"jaime pressly, devon aoki, sarah carter","action, adventure",87
a2135,the dog problem,2007,scott caan,"giovanni ribisi, lynn collins, scott caan",comedy,88
a2136,dreamgirls,2006,bill condon,"beyoncé knowles, jamie foxx, eddie murphy","drama, music, musical",130
a2137,dreamland,2007,jason matzner,"agnes bruckner, kelli garner, justin long",drama,88
a2138,driftwood,1997,ronan o'leary,"james spader, anne brochet, barry mcgovern",thriller,100
a2139,dancin' it's on,2015,david winters,"gary daniels, witney carson, jordan clark","family, musical",89
a2140,employee of the month,2006,greg coolidge,"jessica simpson, dane cook, dax shepard","comedy, romance",103
a2141,encounter point,2006,ronit avni,"ali abu awwad, sami al jundi, robi damelin",documentary,89
a2142,end game,2006,andy cheng,"cuba gooding jr., angie harmon, james woods","action, crime, drama, mystery, thriller",93
a2143,end of the spear,2006,jim hanon,"louie leonardo, chad allen, jack guzman","adventure, drama",108
a2144,eight below,2006,frank marshall,"paul walker, jason biggs, bruce greenwood","adventure, drama, family",120
a2145,eragon,2006,stefen fangmeier,"ed speleers, sienna guillory, jeremy irons","action, adventure, family, fantasy",104
a2146,everyone's hero,2006,colin brady,"jake t. austin, brian dennehy, whoopi goldberg","animation, adventure, comedy, family, sport",88
a2147,evil bong,2006,charles band,"david weidoff, john patrick jordan, mitch eakins","comedy, horror",86
a2148,expiration date,2014,john cook,"nathan vetterlein, dennis bateman, ashly burch","animation, short, action, comedy",15
a2149,facing the giants,2006,alex kendrick,"alex kendrick, shannen fields, jason mcleod","drama, sport",111
a2150,factory girl,2007,george hickenlooper,"sienna miller, guy pearce, hayden christensen","biography, drama",90
a2151,failure to launch,2006,tom dey,"matthew mcconaughey, sarah jessica parker, kathy bates","comedy, romance",97
a2152,the fast and the furious: tokyo drift,2006,justin lin,"lucas black, zachery ty bryan, shad moss","action, crime, drama, thriller",104
a2153,fast food nation,2006,richard linklater,"greg kinnear, bruce willis, catalina sandino moreno","comedy, drama, romance",116
a2154,fatwa,2006,john carter,"lacey chabert, john doman, lauren holly","drama, thriller",91
a2155,fay grim,2007,hal hartley,"parker posey, jeff goldblum, liam aiken","action, comedy, thriller",118
a2156,fearless,2006,ronny yu,"jet li, li sun, yong dong","action, biography, drama, sport",104
a2157,fifty pills,2006,theo avgerinos,"diora baird, kristen bell, michael masini","comedy, crime, drama",85
a2158,final destination 3,2006,james wong,"mary elizabeth winstead, ryan merriman, kris lemche","horror, thriller",93
a2159,find me guilty,2006,sidney lumet,"vin diesel, peter dinklage, ron silver","biography, comedy, crime, drama",125
a2160,firewall,2006,richard loncraine,"harrison ford, virginia madsen, paul bettany","crime, thriller",105
a2161,flags of our fathers,2006,clint eastwood,"ryan phillippe, barry pepper, joseph cross","drama, history, war",135
a2162,flicka,2006,michael mayer,"alison lohman, tim mcgraw, maria bello","adventure, drama, family",95
a2163,flock of dodos: the evolution-intelligent design circus,2006,randy olson,"michael behe, john calvert, jack cashill",documentary,84
a2164,flourish,2006,kevin palys,"jennifer morrison, jesse spencer, leighton meester","comedy, drama, mystery",95
a2165,flushed away,2006,david bowers,"hugh jackman, kate winslet, ian mckellen","animation, adventure, comedy, family",85
a2166,flyboys,2006,tony bill,"james franco, jean reno, jennifer decker","action, adventure, drama, history, romance, war",140
a2167,for your consideration,2006,christopher guest,"catherine o'hara, parker posey, christopher guest",comedy,86
a2168,forget about it,2006,bj davis,"burt reynolds, robert loggia, charles durning","comedy, drama",88
a2169,the fountain,2006,darren aronofsky,"hugh jackman, rachel weisz, sean patrick thomas","drama, romance, sci-fi",96
a2170,freedomland,2006,joe roth,"julianne moore, samuel l. jackson, edie falco","crime, drama, mystery, thriller",113
a2171,free jimmy,2006,christopher nielsen,"woody harrelson, simon pegg, phil daniels","animation, comedy",86
a2172,friends with money,2006,nicole holofcener,"jennifer aniston, frances mcdormand, catherine keener","comedy, drama, romance",88
a2173,full grown men,2006,david munro,"matt mcgrath, judah friedlander, alan cumming","comedy, drama",78
a2174,fur: an imaginary portrait of diane arbus,2006,steven shainberg,"nicole kidman, robert downey jr., ty burrell","biography, drama, romance",122
a2175,game 6,2005,michael hoffman,"michael keaton, robert downey jr., griffin dunne","comedy, drama, sport",87
a2176,garfield 2,2006,tim hill,"breckin meyer, jennifer love hewitt, billy connolly","comedy, family, fantasy",78
a2177,the genius club,2006,timothy a. chey,"tom sizemore, stephen baldwin, carol abney","drama, thriller",119
a2178,g.i. jesus,2006,carl colpaert,"joe arquette, patrícia mota, telana lynum","drama, fantasy",100
a2179,glastonbury,2006,julien temple,"david bowie, björk, james brown","documentary, music",138
a2180,glory road,2006,james gartner,"josh lucas, derek luke, austin nichols","biography, drama, sport",118
a2181,god grew tired of us,2007,christopher dillon quinn,"panther bior, john bul dau, nicole kidman",documentary,89
a2182,the good german,2007,steven soderbergh,"george clooney, cate blanchett, tobey maguire","drama, mystery, thriller",105
a2183,the good shepherd,2006,robert de niro,"matt damon, angelina jolie, robert de niro","drama, history, thriller",167
a2184,a good year,2006,ridley scott,"russell crowe, abbie cornish, albert finney","comedy, drama, romance",117
a2185,goya's ghosts,2006,milos forman,"javier bardem, natalie portman, stellan skarsgård","biography, drama, history",113
a2186,grandma's boy,2006,nicholaus goossen,"allen covert, linda cardellini, shirley jones",comedy,94
a2187,the great warming,2006,,"severn cullis-suzuki, alanis morissette, keanu reeves",documentary,85
a2188,gridiron gang,2006,phil joanou,"dwayne johnson, xzibit, l. scott caldwell","crime, drama, sport",125
a2189,the groomsmen,2006,edward burns,"edward burns, matthew lillard, brittany murphy","comedy, drama, music, romance",98
a2190,the grudge 2,2006,takashi shimizu,"amber tamblyn, edison chen, arielle kebbel","horror, thriller",102
a2191,the guardian,2006,andrew davis,"kevin costner, ashton kutcher, sela ward","action, adventure, drama",139
a2192,the guatemalan handshake,2006,todd rohal,"katy haywood, ken byrnes, will oldham","comedy, drama",98
a2193,a guide to recognizing your saints,2006,dito montiel,"robert downey jr., rosario dawson, shia labeouf","crime, drama",100
a2194,half nelson,2006,ryan fleck,"ryan gosling, anthony mackie, shareeka epps",drama,106
a2195,the hamiltons,2006,mitchell altieri,"cory knauf, samuel child, joseph mckelheer","drama, horror, thriller",86
a2196,happy feet,2006,george miller,"elijah wood, brittany murphy, hugh jackman","animation, comedy, family, music",108
a2197,the hard corps,2006,sheldon lettich,"jean-claude van damme, razaaq adoti, vivica a. fox","action, thriller",110
a2198,harsh times,2006,david ayer,"christian bale, eva longoria, freddy rodríguez","action, crime, drama, thriller",116
a2199,the hawk is dying,2008,julian goldberger,"paul giamatti, michelle williams, michael pitt",drama,112
a2200,header,2009,archibald flancranstin,"jake suffian, elliot v. kotek, dick mullaney","comedy, crime, drama, horror, mystery, thriller",89
a2201,the heart of steel,2008,angelo guglielmo,,documentary,54
a2202,the heart of the game,2006,ward serrill,"darnellia russell, bill resler, ludacris","documentary, sport",97
a2203,the hills have eyes,2006,alexandre aja,"ted levine, kathleen quinlan, dan byrd","horror, thriller",107
a2204,the holiday,2006,nancy meyers,"kate winslet, cameron diaz, jude law","comedy, romance",138
a2205,hollywoodland,2006,allen coulter,"adrien brody, ben affleck, diane lane","biography, crime, drama, history, mystery, romance, thriller",126
a2206,hollow man ii,2006,claudio fäh,"christian slater, peter facinelli, laura regan","action, horror, sci-fi, thriller",91
a2207,home of the brave,2007,irwin winkler,"samuel l. jackson, 50 cent, jessica biel","action, drama, war",106
a2208,hood of horror,2007,stacy title,"snoop dogg, daniella alonso, anson mount","comedy, horror",84
a2209,hoot,2006,wil shriner,"logan lerman, luke wilson, brie larson","adventure, comedy, family",91
a2210,the hottest state,2007,ethan hawke,"catalina sandino moreno, laura linney, mark webber","drama, music, romance",117
a2211,how to eat fried worms,2006,bob dolman,"luke benward, hallie kate eisenberg, adam hicks","comedy, family",98
a2212,hurricane on the bayou,2006,greg macgillivray,"bear badeaux, tab benoit, peggy burgard",documentary,42
a2213,i want someone to eat cheese with,2006,jeff garlin,"jeff garlin, sarah silverman, bonnie hunt","comedy, romance",80
a2214,ice age: the meltdown,2006,carlos saldanha,"ray romano, john leguizamo, denis leary","animation, action, adventure, comedy, family, fantasy",91
a2215,idiocracy,2007,mike judge,"luke wilson, maya rudolph, dax shepard","adventure, comedy, sci-fi, thriller",84
a2216,idlewild,2006,bryan barber,"big boi, terrence howard, andré benjamin","crime, drama, musical, romance",121
a2217,the illusionist,2006,neil burger,"edward norton, jessica biel, paul giamatti","drama, mystery, romance, thriller",110
a2218,an inconvenient truth,2006,davis guggenheim,"al gore, billy west, george bush",documentary,96
a2219,inland empire,2007,david lynch,"laura dern, jeremy irons, justin theroux","drama, mystery, thriller",180
a2220,inside man,2006,spike lee,"denzel washington, clive owen, jodie foster","crime, drama, mystery, thriller",129
a2221,the insurgents,2007,scott dacko,"john shea, mary stuart masterson, henry simmons","drama, thriller",82
a2222,unbroken,2014,angelina jolie,"jack o'connell, miyavi, domhnall gleeson","biography, drama, sport, war",137
a2223,innerspace,1987,joe dante,"dennis quaid, martin short, meg ryan","action, adventure, comedy, fantasy, sci-fi, thriller",120
a2224,iraq for sale: the war profiteers,2006,robert greenwald,"katy helvenston-wettengal, scott helvenston, donna zovko","documentary, war",75
a2225,iraq in fragments,2007,james longley,"mohammed haithem, suleiman mahmoud, muqtada al-sadr","documentary, war",94
a2226,irish jam,2006,john eyres,"dudley sutton, tom georgeson, anna friel",comedy,94
a2227,jackass number two,2006,jeff tremaine,"johnny knoxville, steve-o, chris pontius","documentary, action, comedy",92
a2228,jack smith and the destruction of atlantis,2006,mary jordan,"jack smith, nayland blake, ira cohen",documentary,94
a2229,jesus camp,2007,heidi ewing,"mike papantonio, lou engle, becky fischer","documentary, drama",87
a2230,jewish american princess,2006,ian davis,jonelle freed,documentary,78
a2231,jimmy and judy,2006,randall rubin,"edward furlong, rachael bella, william sadler","crime, drama, thriller",99
a2232,john tucker must die,2006,betty thomas,"jesse metcalfe, ashanti, arielle kebbel","comedy, romance",89
a2233,jonestown: the life and death of peoples temple,2006,stanley nelson,"rebecca moore, janet shular, tim carter","documentary, history",86
a2234,just my luck,2006,donald petrie,"lindsay lohan, chris pine, samaire armstrong","comedy, fantasy, romance",103
a2235,kalamazoo,1995,claudia silver,"emily cutler, jamie harrold, scott renderer",short,29
a2236,karla,2006,joel bender,"laura prepon, misha collins, patrick bauchau","crime, drama, thriller",99
a2237,keeping up with the steins,2006,scott marshall,"jeremy piven, garry marshall, daryl sabara",comedy,90
a2238,kill your darlings,2013,john krokidas,"daniel radcliffe, dane dehaan, michael c. hall","biography, drama, romance, thriller",104
a2239,kurt cobain about a son,2007,aj schnack,"kurt cobain, michael azerrad, courtney love","documentary, music",96
a2240,lady in the water,2006,m. night shyamalan,"paul giamatti, bryce dallas howard, jeffrey wright","fantasy, mystery, thriller",110
a2241,the lake house,2006,alejandro agresti,"keanu reeves, sandra bullock, christopher plummer","drama, fantasy, romance",99
a2242,land of the blind,2007,robert edwards,"ralph fiennes, donald sutherland, tom hollander","drama, thriller",110
a2243,larry the cable guy: health inspector,2006,trent cooper,"larry the cable guy, david koechner, michael papajohn","comedy, romance",89
a2244,the last kiss,2006,tony goldwyn,"zach braff, jacinda barrett, rachel bilson","comedy, drama, romance",104
a2245,last holiday,2006,wayne wang,"queen latifah, ll cool j, timothy hutton","adventure, comedy, drama",112
a2246,the last winter,2008,larry fessenden,"ron perlman, james le gros, connie britton","horror, thriller",101
a2247,let's go to prison,2006,bob odenkirk,"dax shepard, will arnett, chi mcbride","comedy, crime",84
a2248,letters from iwo jima,2007,clint eastwood,"ken watanabe, kazunari ninomiya, tsuyoshi ihara","drama, history, war",141
a2249,lime salted love,2007,danielle agnello,"kristanna loken, joe hall, danielle agnello",drama,120
a2250,little chenier,2008,bethany ashton wolf,"johnathon schaech, fred koehler, tamara braun",drama,120
a2251,little children,2007,todd field,"kate winslet, jennifer connelly, patrick wilson","drama, romance",136
a2252,littleman,2006,keenen ivory wayans,"shawn wayans, marlon wayans, kerry washington","comedy, crime, fantasy",98
a2253,little miss sunshine,2006,jonathan dayton,"steve carell, toni collette, greg kinnear","comedy, drama",101
a2254,live freaky die freaky,2006,john roecker,"nick 13, billie joe armstrong, tim armstrong","animation, comedy, musical, sci-fi",75
a2255,local color,2009,george gallo,"armin mueller-stahl, trevor morgan, ray liotta",drama,107
a2256,lol,2012,lisa azuelos,"miley cyrus, douglas booth, ashley greene","comedy, drama, romance",97
a2257,lonely hearts,2006,todd robinson,"john travolta, salma hayek, jared leto","crime, drama, romance, thriller",108
a2258,a lonely place to die,2011,julian gilbey,"alec newman, ed speleers, melissa george","action, adventure, crime, thriller",99
a2259,loren cass,2006,chris fuller,"kayla tabish, travis maynard, chris fuller","drama, music",83
a2260,loving annabelle,2007,katherine brooks,"erin kelly, diane gaidry, laura breckenridge","drama, romance",76
a2261,lucky number slevin,2006,paul mcguigan,"josh hartnett, ben kingsley, morgan freeman","crime, drama, mystery, thriller",110
a2262,mad cowgirl,2006,gregory hatanaka,"sarah lassez, james duval, devon odessa","drama, horror, romance, thriller",89
a2263,madea's family reunion,2006,tyler perry,"tyler perry, blair underwood, lynn whitfield","comedy, drama, romance",107
a2264,the marine,2006,john bonito,"john cena, kelly carlson, robert patrick","action, drama, thriller",92
a2265,man about town,2006,mike binder,"ben affleck, rebecca romijn, john cleese","comedy, drama",96
a2266,man of the year,2006,barry levinson,"robin williams, laura linney, lewis black","comedy, drama, romance, thriller",115
a2267,marie antoinette,2006,sofia coppola,"kirsten dunst, jason schwartzman, rip torn","biography, drama, history",123
a2268,mark of the damned,2006,eric miller,"jeff bostic, rob burns, josh kennedy","horror, sci-fi",105
a2269,material girls,2006,martha coolidge,"hilary duff, haylie duff, anjelica huston","comedy, family, romance",98
a2270,matthew barney: no restraint,2008,alison chernick,"matthew barney, björk",documentary,72
a2271,maxed out,2012,jeffrey hirschberg,"lisa dee, marlo dicrasto, dresden engle","short, comedy",14
a2272,mini's first time,2007,nick guthe,"alec baldwin, nikki reed, carrie-anne moss","comedy, crime, drama",91
a2273,minotaur,2006,jonathan english,"tom hardy, michelle van der water, tony todd","adventure, fantasy, horror",93
a2274,miss potter,2007,chris noonan,"renée zellweger, ewan mcgregor, emily watson","biography, drama, romance",92
a2275,modern man,2013,sebastian solberg,"sean knopp, ramanique ahluwalia, samira ahmed","short, comedy, sci-fi",4
a2276,monster house,2006,gil kenan,"mitchel musso, sam lerner, spencer locke","animation, comedy, family, fantasy, mystery",91
a2277,the monster of phantom lake,2006,christopher r. mihm,"josh craig, leigha horton, deanne mcdonald","comedy, horror, sci-fi",97
a2278,moonshine,2006,roger ingraham,"brian greer, sarah ingraham, gareth duvall","comedy, horror",73
a2279,mustang sally,2006,iren koster,"elizabeth daily, lindsey labrum, mark parrish","action, horror, thriller",85
a2280,my country my country,2006,laura poitras,,documentary,90
a2282,my super ex-girlfriend,2006,ivan reitman,"uma thurman, luke wilson, anna faris","comedy, romance, sci-fi",95
a2283,nacho libre,2006,jared hess,"jack black, ana de la reguera, héctor jiménez","comedy, family, sport",92
a2285,the nativity story,2006,catherine hardwicke,"keisha castle-hughes, shohreh aghdashloo, oscar isaac","drama, family",101
a2286,neil young: heart of gold,2006,jonathan demme,"neil young, emmylou harris, pegi young","documentary, music",103
a2287,night at the museum,2006,shawn levy,"ben stiller, carla gugino, ricky gervais","action, adventure, comedy, family, fantasy",108
a2288,the night listener,2006,patrick stettner,"robin williams, toni collette, rory culkin","crime, mystery, thriller",91
a2289,night of the living dead 3d,2006,jeff broadstreet,"brianna brown, joshua desroches, sid haig",horror,80
a2290,the night of the white pants,2006,amy talkington,"tom wilkinson, nick stahl, selma blair","comedy, drama",87
a2291,nightmare man,2006,rolfe kanefsky,"tiffany shepis, blythe metz, luciano szafir","comedy, horror, thriller",89
a2292,unthinkable,2010,gregor jordan,"samuel l. jackson, carrie-anne moss, michael sheen","drama, thriller",97
a2293,o jerusalem,2006,ã‰lie chouraqui,"jj feild, saïd taghmaoui, maria papas",drama,100
a2294,occupation 101,2007,abdallah omeish,"james akins, arik ascherman, bishop barltlett jr.",documentary,90
a2295,the oh in ohio,2007,billy kent,"parker posey, paul rudd, danny devito","comedy, drama, romance",88
a2296,old joy,2007,kelly reichardt,"daniel london, will oldham, tanya smith",drama,76
a2297,the omen,1976,richard donner,"gregory peck, lee remick, harvey stephens","horror, mystery",111
a2298,one night with the king,2006,michael o. sajbel,"tiffany dupont, luke goss, john noble","biography, drama, history",123
a2299,once in a lifetime: the extraordinary story of the new york cosmos,2006,paul crowder,"pelé, giorgio chinaglia, matt dillon","documentary, sport",97
a2300,open season,2006,roger allers,"ashton kutcher, martin lawrence, debra messing","animation, adventure, comedy, family",83
a2301,over the hedge,2006,tim johnson,"bruce willis, garry shandling, steve carell","animation, adventure, comedy, family",83
a2302,the painted veil,2007,john curran,"naomi watts, edward norton, liev schreiber","drama, romance",125
a2303,pan's labyrinth,2007,guillermo del toro,"ivana baquero, ariadna gil, sergi lópez","drama, fantasy, war",118
a2304,park,2006,kurt voelker,"dagney kerr, tank, vincent riverside","comedy, drama",86
