ID,Title,Year,Director,Cast,Genre,Duration
1604,Wendigo: Bound by Blood,2010,Len Kabasinski,"Brian Anthony, Brian Arrington, Sara Brooks","Action, Horror, Sci-Fi",85 min 
1605,Portrait of the Fighter as a Young Man,2010,Constantin Popescu,"Constantin Dita, Bogdan Dumitrache, Ionut Caras","Action, Drama, History",163 min 
1606,Rakhta Charitra 2,2010,Ram Gopal Varma,"Shatrughan Sinha, Vivek Oberoi, Suriya","Action, Crime, Drama",135 min 
1607,Blades of Blood,2010,Joon-ik Lee,"Jeong-min Hwang, Seung-won Cha, Ji-hye Han",Action,108 min 
1608,Red Eagle,2010,Wisit Sasanatieng,,"Action, Sci-Fi, Thriller",130 min 
1609,Ninjas vs. Vampires,2010,Justin Timpane,"Jay Saunders, Daniel Ross, Cory Okouchi","Action, Comedy, Fantasy",89 min 
1610,Crook: It's Good to Be Bad,2010,Mohit Suri,"Emraan Hashmi, Neha Sharma, Arjan Bajwa","Action, Drama, Thriller",121 min 
1611,Escape from New Jersey,2010,Chris R. Notarile,"Hector De La Rosa, Kim Santiago, Roberto Lombardi","Action, Adventure, Sci-Fi",45 min 
1612,Madame X,2010,Lucky Kuswandi,"Joko Anwar, Titi Dwijayati, Ikhsan Himawan","Action, Comedy",100 min 
1613,Ragada,2010,Veeru Potla,"Nagarjuna Akkineni, Anushka Shetty, Priyamani","Action, Comedy, Drama",146 min 
1614,Jackie,2010,Soori,"Puneeth Rajkumar, Bhavana, Harshika Poonacha",Action,126 min 
1615,The Trashmaster,2010,Mathieu Weschler,Matt Challands,"Animation, Action",90 min 
1616,GR30k,2010,Daniel Falicki,"Rachel Finan, Jacqueline Joy, Michael O'Hair","Animation, Action, Adventure",127 min 
1617,BKO: Bangkok Knockout,2010,Panna Rittikrai,"Sorapong Chatree, Kerttisak Udomnak, Krittiya Lardphanna",Action,106 min 
1618,My Best Bodyguard,2010,Sirippakorn Wongchariyawat,,"Action, Adventure",113 min 
1619,23,2010,Craig Deering,"Craig Deering, Allen Murphy, Joe Korbel","Action, Comedy",104 min 
1620,Si Agimat at si Enteng Kabisote,2010,Tony Y. Reyes,"Vic Sotto, Ramon 'Bong' Revilla Jr., Sam Pinto","Action, Comedy, Fantasy",110 min 
1621,300 Killers,2010,Matt Jaissle,"Johnny Andrews, Matt Jaissle, Sabastian Love","Action, Horror, Thriller",75 min 
1622,Wind Blast,2010,Qunshu Gao,"Yihong Duan, Wu Jing, Zhang Li",Action,114 min 
1623,Who Killed Captain Alex?,2010,Nabwana I.G.G.,"Kakule William, Kakule Wilson, Sserunya Ernest",Action,64 min 
1624,Bang Rajan 2,2010,Tanit Jitnukul,,"Action, Adventure, War",127 min 
1625,Valley of the Dead,2010,K. Adithya Ashok,"Lex Yochim, Max Horner, Timothy Luke",Action,50 min 
1626,Kandahar,2010,Major Ravi,,"Action, Drama",150 min 
1627,Boca,2010,Flavio Frederico,"Daniel de Oliveira, Hermila Guedes, Jefferson Brasil","Action, Crime, Drama",100 min 
1628,Vampire Warriors,2010,Dennis Law,"Luxia Jiang, Wah Yuen, Chrissie Chow","Action, Thriller",100 min 
1629,Edge of the Empire,2010,Nirattisai Kaljareuk,,Action,117 min 
1630,The Bucks County Massacre,2010,Jason Sherman,"Nikki Bell, Zackary Kresser, Brittany Geiger","Action, Horror, Thriller",84 min 
1631,Hae-gyeol-sa,2010,Hyeok-jae Kwon,"Kyung-gu Sol, Jung-Jin Lee, Dal-su Oh","Action, Crime, Drama",99 min 
1632,CO2,2010,John Depew,"Jared Starr, Grace Young, Kate Bailey","Action, Adventure, Drama",120 min 
1633,The Hooker with a Heart of Gold,2010,Brad Jones,"Sarah Lewis, Brian Lewis, Brad Jones","Action, Comedy, Thriller",149 min 
1634,Kung Fu Wing Chun,2010,Tung Cho 'Joe' Cheung,"Jing Bai, Shaoqun Yu, Collin Chou","Action, Comedy, Romance",110 min 
1635,Haunters,2010,Min-suk Kim,"Dong-won Kang, Duek-mun Choi, Jeong Eun-Chae","Action, Sci-Fi, Thriller",100 min 
1636,The Samurai of Ayothaya,2010,Nopporn Watin,,"Action, Drama, History",100 min 
1637,Number One Shakib Khan,2010,Badiul Alam Khokon,"Shakib Khan, Apu Biswas, Misa Sawdagar","Action, Comedy, Drama",175 min 
1638,Lalbaug Parel,2010,Mahesh Manjrekar,"Vinay Apte, Seema Biswas, Ankush Choudhary",Action,146 min 
1639,Na-neun Abba-da,2010,Se-Yeong Lee,"Seung-woo Kim, Byung-ho Son, Ha-ryong Im","Action, Crime, Drama",99 min 
1640,Killer Clown,2010,Julian Cheah,"Julian Cheah, Milly Sherratt, Peter Jackson","Action, Horror, Thriller",79 min 
1641,El Negocio,2010,Tim Bulot,"David Angel, Pedro Blanco, Tim Bulot",Action,58 min 
1642,Shock Invasion,2010,Frank Sudol,Frank Sudol,"Animation, Action, Adventure",71 min 
1643,Re-Generator,2010,Olivier Gruner,"Olivier Gruner, David J. Phillips, Paul Logan","Action, Sci-Fi",94 min 
1644,The LXD: The Uprising Begins,2010,Jon M. Chu,"Alize Albuquerque, Philip Albuquerque, Joshua Lee Ayers","Action, Adventure, Music",80 min 
1645,Blood and Bone,2009,Ben Ramsey,"Michael Jai White, Julian Sands, Eamonn Walker","Action, Drama",93 min 
1646,Whiteout,2009,Dominic Sena,"Kate Beckinsale, Gabriel Macht, Tom Skerritt","Action, Crime, Mystery",101 min 
1647,Astro Boy,2009,David Bowers,"Freddie Highmore, Nicolas Cage, Kristen Bell","Animation, Action, Family",94 min 
1648,The Haunted World of El Superbeasto,2009,Rob Zombie,"Joe Alaskey, Ken Foree, Tom Papa","Animation, Action, Comedy",77 min 
1649,Royal Kill,2009,Babar Ahmed,"Alexander Wraith, Gail Kim, Lalaine","Action, Thriller",90 min 
1650,Daybreakers,2009,Michael Spierig,"Ethan Hawke, Willem Dafoe, Sam Neill","Action, Horror, Sci-Fi",98 min 
1651,The Perfect Sleep,2009,Jeremy Alter,"Anton Pardoe, Anthony Dilio, David Beck","Action, Drama, Romance",99 min 
1652,Terminator Salvation,2009,McG,"Christian Bale, Sam Worthington, Anton Yelchin","Action, Sci-Fi",115 min 
1653,Cirque du Freak: The Vampire's Assistant,2009,Paul Weitz,"Chris Massoglia, John C. Reilly, Salma Hayek","Action, Adventure, Fantasy",109 min 
1654,From Mexico with Love,2009,Jimmy Nickerson,"Kuno Becker, Steven Bauer, Stephen Lang","Action, Drama",96 min 
1655,Push,2009,Paul McGuigan,"Camilla Belle, Dakota Fanning, Chris Evans","Action, Sci-Fi, Thriller",111 min 
1656,The Tournament,2009,Scott Mann,"Ving Rhames, Robert Carlyle, Kelly Hu","Action, Thriller",95 min 
1657,9,2009,Shane Acker,"Elijah Wood, Jennifer Connelly, Crispin Glover","Animation, Action, Adventure",79 min 
1658,Once Upon a Time in Dublin,2009,Jason Figgis,"Emmett J Scanlan, Eoin Macken, Bill Fellows","Action, Drama, Thriller",97 min 
1659,Star Trek,2009,J.J. Abrams,"Chris Pine, Zachary Quinto, Simon Pegg","Action, Adventure, Sci-Fi",127 min 
1660,Surviving Evil,2009,Terence Daw,"Billy Zane, Christina Cole, Natalie Mendoza","Action, Horror, Thriller",90 min 
1661,Blood: The Last Vampire,2009,Chris Nahon,"Ji-hyun Jun, Allison Miller, Liam Cunningham","Action, Horror, Thriller",91 min 
1662,The Belgrade Phantom,2009,Jovan B. Todorovic,"Marko Zivic, Radoslav Milenkovic, Nada Macankovic","Action, Crime, Drama",82 min 
1663,A Day in the Life,2009,Sticky Fingaz,"Alvin 'Porky' Holland, Bokeem Woodbine, Chris Fleming","Action, Crime, Drama",90 min 
1664,Underworld: Rise of the Lycans,2009,Patrick Tatopoulos,"Rhona Mitra, Michael Sheen, Bill Nighy","Action, Adventure, Fantasy",92 min 
1665,Silver Medallist,2009,Hao Ning,"Lifan Dong, Bo Huang, Kong Jiu","Action, Adventure, Comedy",99 min 
1666,Evangelion: 2.0 You Can (Not) Advance,2009,Masayuki,"Kotono Mitsuishi, Megumi Ogata, Megumi Hayashibara","Animation, Action, Drama",112 min 
1667,First Strike,2009,Steven Bratter,"Duane Daniels, Cristian Letelier, Mette Holt","Action, Sci-Fi, Thriller",90 min 
1668,Kerala Varma Pazhassi Raja,2009,T. Hariharan,"Mammootty, Sarath Kumar, Mohanlal","Action, Drama, History",195 min 
1669,Street Fighter: The Legend of Chun-Li,2009,Andrzej Bartkowiak,"Kristin Kreuk, Neal McDonough, Michael Clarke Duncan","Action, Crime, Fantasy",96 min 
1670,Serbian Scars,2009,Brent Huff,"Vladimir Rajcic, Michael Madsen, Mark Dacascos","Action, Drama, Thriller",97 min 
1671,Monsters vs. Aliens,2009,Rob Letterman,"Reese Witherspoon, Rainn Wilson, Stephen Colbert","Animation, Action, Adventure",94 min 
1672,The International,2009,Tom Tykwer,"Clive Owen, Naomi Watts, Armin Mueller-Stahl","Action, Crime, Drama",118 min 
1673,Breaking Point,2009,Jeff Celentano,"Tom Berenger, Busta Rhymes, Armand Assante","Action, Crime, Drama",93 min 
1674,Solomon Kane,2009,Michael J. Bassett,"James Purefoy, Max von Sydow, Rachel Hurd-Wood","Action, Adventure, Fantasy",104 min 
1675,Obitaemyy ostrov,2009,Fedor Bondarchuk,"Vasiliy Stepanov, Yuliya Snigir, Pyotr Fyodorov","Action, Adventure, Sci-Fi",115 min 
1676,All Screwed Up,2009,Neil Stephens,"Chyna Layne, Jake Waldman, Allison Carter Thomas","Action, Comedy, Family",90 min 
1677,Minty: The Assassin,2009,Eugene Baldovino,"Jacki R. Chan, Jade English, Chip Joslin","Action, Adventure, Comedy",80 min 
1678,Surrogates,2009,Jonathan Mostow,"Bruce Willis, Radha Mitchell, Ving Rhames","Action, Sci-Fi, Thriller",89 min 
1679,Sherlock Holmes,2009,Guy Ritchie,"Robert Downey Jr., Jude Law, Rachel McAdams","Action, Adventure, Crime",128 min 
1680,The Butcher,2009,Jesse V. Johnson,"Eric Roberts, Robert Davi, Keith David","Action, Thriller",95 min 
1681,Perrier's Bounty,2009,Ian Fitzgibbon,"Gabriel Byrne, Cillian Murphy, Michael McElhatton","Action, Comedy, Crime",88 min 
1682,Fast & Furious,2009,Justin Lin,"Vin Diesel, Paul Walker, Michelle Rodriguez","Action, Crime, Drama",107 min 
1683,Night Train,2009,Brian King,"Danny Glover, Leelee Sobieski, Steve Zahn","Action, Crime, Mystery",83 min 
1684,Infestation,2009,Kyle Rankin,"Chris Marquette, Brooke Nevin, Kinsey Packard","Action, Comedy, Horror",91 min 
1685,Vampire Killers,2009,Phil Claydon,"Paul McGann, James Corden, MyAnna Buring","Action, Comedy, Horror",86 min 
1686,Gamer,2009,Mark Neveldine,"Gerard Butler, Michael C. Hall, Ludacris","Action, Sci-Fi, Thriller",95 min 
1687,Deadland,2009,Damon O'Steen,"Gary Weeks, Brian Tee, William Katt","Action, Drama, Sci-Fi",107 min 
1688,Eyeborgs,2009,Richard Clabaugh,"Adrian Paul, Dale Girard, Mikey Wiseman","Action, Crime, Sci-Fi",102 min 
1689,G.I. Joe: The Rise of Cobra,2009,Stephen Sommers,"Dennis Quaid, Channing Tatum, Marlon Wayans","Action, Adventure, Sci-Fi",118 min 
1690,For a Fistful of Diamonds,2009,Dominique Milano,"Chuti Tiu, Abdel-Aziz Essayed, Fabrice Sopoglian",Action,87 min 
1691,Transformers: Revenge of the Fallen,2009,Michael Bay,"Shia LaBeouf, Megan Fox, Josh Duhamel","Action, Adventure, Sci-Fi",150 min 
1692,The Way,2009,Vladimir Pasichnik,"Dmitriy Nosov, Aleksey Orlov, Dmitriy Maksimov","Action, Adventure",90 min 
1693,Ink,2009,Jamin Winans,"Christopher Soren Kelly, Quinn Hunchar, Jessica Duffy","Action, Fantasy",107 min 
1694,Race to Witch Mountain,2009,Andy Fickman,"Dwayne Johnson, Carla Gugino, AnnaSophia Robb","Action, Adventure, Family",98 min 
1695,Shinjuku Incident,2009,Tung-Shing Yee,"Jackie Chan, Naoto Takenaka, Daniel Wu","Action, Crime, Drama",119 min 
1696,Night at the Museum: Battle of the Smithsonian,2009,Shawn Levy,"Ben Stiller, Owen Wilson, Amy Adams","Action, Adventure, Comedy",105 min 
1697,Ice Age: Dawn of the Dinosaurs,2009,Carlos Saldanha,"Ray Romano, John Leguizamo, Denis Leary","Animation, Action, Adventure",94 min 
1698,Dirty Mind,2009,Pieter Van Hees,"Wim Helsen, Robbie Cleiren, Kristine Van Pellicom","Action, Comedy",102 min 
1699,Chicago Overcoat,2009,Brian Caunter,"Frank Vincent, Kathrine Narducci, Mike Starr","Action, Adventure, Crime",94 min 
1700,City Rats,2009,Steve Kelly,"Tamer Hassan, Ray Panthaki, Susan Lynch","Action, Comedy, Drama",94 min 
1701,Chandni Chowk to China,2009,Nikhil Advani,"Akshay Kumar, Deepika Padukone, Chia-Hui Liu","Action, Adventure, Comedy",154 min 
1702,Next Day Air,2009,Benny Boom,"Yasiin Bey, Mike Epps, Donald Faison","Action, Comedy, Crime",84 min 
1703,Dragonball: Evolution,2009,James Wong,"Justin Chatwin, James Marsters, Yun-Fat Chow","Action, Adventure, Fantasy",85 min 
1704,Red Sands,2009,Alex Turner,"Shane West, Leonard Roberts, Aldis Hodge","Action, Horror, Thriller",89 min 
1705,La Linea - The Line,2009,James Cotten,"Ray Liotta, Andy Garcia, Esai Morales","Action, Crime, Drama",95 min 
1706,Thick as Thieves,2009,Mimi Leder,"Rade Serbedzija, Morgan Freeman, Robert Forster","Action, Crime, Thriller",104 min 
1707,Paul Blart: Mall Cop,2009,Steve Carr,"Kevin James, Keir O'Donnell, Jayma Mays","Action, Comedy, Crime",91 min 
1708,Breathe,2009,Nicholas Winter,,"Action, Drama",86 min 
1709,Crank: High Voltage,2009,Mark Neveldine,"Jason Statham, Amy Smart, Clifton Collins Jr.","Action, Crime, Thriller",96 min 
1710,Echelon Conspiracy,2009,Greg Marcks,"Shane West, Edward Burns, Ving Rhames","Action, Crime, Mystery",105 min 
1711,The Way of War,2009,John Carter,"Cuba Gooding Jr., Clarence Williams III, John Terry","Action, Thriller",90 min 
1712,H2O Extreme,2009,William Scharpf,"Chris Carmack, Nikki Griffin, Rider Strong","Action, Sport",95 min 
1713,District 9,2009,Neill Blomkamp,"Sharlto Copley, David James, Jason Cope","Action, Sci-Fi, Thriller",112 min 
1714,Death Warrior,2009,Bill Corcoran,"Hector Echavarria, Tanya Clarke, Nick Mancuso","Action, Drama, Horror",90 min 
1715,Kambakkht Ishq,2009,Sabir Khan,"Sylvester Stallone, Denise Richards, Brandon Routh","Action, Comedy, Romance",142 min 
1716,Fatal Rescue,2009,Stephen Manuel,"Steve Guttenberg, Aislinn Sands, Dominic Rickhards","Action, Drama, Thriller",90 min 
1717,The Devil's Tomb,2009,Jason Connery,"Cuba Gooding Jr., Ray Winstone, Ron Perlman","Action, Horror, Sci-Fi",90 min 
1718,Tidal Wave,2009,JK Youn,"Ji-won Ha, Jeong-hwa Eom, Kyung-gu Sol","Action, Drama, Thriller",120 min 
1719,Dance Flick,2009,Damien Dante Wayans,"Marlon Wayans, Shawn Wayans, Shoshana Bush","Action, Comedy, Music",83 min 
1720,Chaostage,2009,Tarek Ehlail,"Ben Becker, Christian Beuter, Stipe Erceg",Action,90 min 
1721,12 Rounds,2009,Renny Harlin,"John Cena, Ashley Scott, Aidan Gillen","Action, Crime, Thriller",108 min 
1722,Super Capers: The Origins of Ed and the Missing Bullion,2009,Ray Griggs,"Justin Whalin, Ray Griggs, Danielle Harris","Action, Adventure, Comedy",98 min 
1723,Set Apart,2009,Ralph E. Portillo,"Ary Katz, Richard Roundtree, John Schneider","Action, Adventure, Drama",97 min 
1724,A Lonely Place for Dying,2009,Justin Eugene Evans,"Michael Scovotti, Ross Marquand, Michael Wincott","Action, Thriller, War",94 min 
1725,The Breath,2009,Levent Semerci,"Mete Horozoglu, Ilker Kizmaz, Baris Bagci","Action, Drama, Thriller",128 min 
1726,Quick Gun Murugun: Misadventures of an Indian Cowboy,2009,Shashanka Ghosh,"Rajendraprasad, Nasser, Rambha","Action, Comedy, Drama",97 min 
1727,Ninja,2009,Isaac Florentine,"Scott Adkins, Tsuyoshi Ihara, Mika Hijii","Action, Crime, Drama",86 min 
1728,The Horde,2009,Yannick Dahan,"Claude Perron, Jean-Pierre Martins, Eriq Ebouaney","Action, Horror, Thriller",90 min 
1729,Kurbaan,2009,Renzil D'Silva,"Kareena Kapoor, Saif Ali Khan, Om Puri","Action, Crime, Drama",161 min 
1730,Ninja Assassin,2009,James McTeigue,"Rick Yune, Naomie Harris, Rain","Action, Crime, Thriller",99 min 
1731,Storm Warriors,2009,Oxide Pang Chun,"Aaron Kwok, Ekin Cheng, Kenny Ho","Action, Adventure, Fantasy",111 min 
1732,Pandorum,2009,Christian Alvart,"Dennis Quaid, Ben Foster, Cam Gigandet","Action, Horror, Mystery",108 min 
1733,2012,2009,Roland Emmerich,"John Cusack, Thandie Newton, Chiwetel Ejiofor","Action, Adventure, Sci-Fi",158 min 
1734,Black Dynamite,2009,Scott Sanders,"Arsenio Hall, Tommy Davidson, Phyllis Applegate","Action, Comedy",84 min 
1735,Zone of the Dead,2009,Milan Konjevic,"Ken Foree, Kristina Klebe, Emilio Roso","Action, Horror",101 min 
1736,The Sniper,2009,Dante Lam,"Richie Jen, Xiaoming Huang, Edison Chen","Action, Adventure, Crime",90 min 
1737,The Assassin Next Door,2009,Danny Lerner,"Olga Kurylenko, Ninette Tayeb, Henry David","Action, Drama, Thriller",102 min 
1738,The Boxer,2009,Thomas Jahn,"Kelly Adams, Gregor Bador, Frank Braun","Action, Drama, Sport",94 min 
1739,Heist,2009,Richard Cooper,"Rick Jordan, Christian Mendez, Erik David Barber","Action, Crime",90 min 
1740,Paintball,2009,Daniel Benmayor,"Brendan Mackey, Jennifer Matter, Patrick Regis","Action, Thriller",86 min 
1741,The Bleeding,2009,Charlie Picerni,"Vinnie Jones, Michael Madsen, Armand Assante","Action, Horror",80 min 
1742,Spy of Orange,2009,Tim Oliehoek,"Paul de Leeuw, Najib Amhali, Jennifer Hoffman","Action, Comedy",90 min 
1743,Command Performance,2009,Dolph Lundgren,"Dolph Lundgren, Melissa Molinaro, Hristo Shopov","Action, Drama, Thriller",93 min 
1744,Bitch Slap,2009,Rick Jacobson,"Julia Voth, Erin Cummings, America Olivo","Action, Comedy, Crime",109 min 
1745,Blue,2009,Anthony D'Souza,"Akshay Kumar, Sanjay Dutt, Lara Dutta","Action, Adventure, Romance",119 min 
1746,Aladin,2009,Sujoy Ghosh,"Shubhankar Atre, Amitabh Bachchan, Victor Banerjee","Action, Adventure, Comedy",132 min 
1747,Newsmakers,2009,Anders Banke,"Andrey Merzlikin, Evgeniy Tsyganov, Maria Mashkova","Action, Crime, Drama",107 min 
1748,Taras Bulba,2009,Vladimir Bortko,"Bogdan Stupka, Igor Petrenko, Vladimir Vdovichenkov","Action, Drama, History",129 min 
1749,Red Alert: The War Within,2009,Ananth Narayan Mahadevan,"Sunil Shetty, Sameera Reddy, Ashish Vidyarthi","Action, Drama, Thriller",120 min 
1750,Interceptor,2009,Konstantin Maksimov,"Igor Petrenko, Lyubov Tolkalina, Aleksandr Baluev","Action, Sci-Fi, Thriller",90 min 
1751,District 13: Ultimatum,2009,Patrick Alessandrin,"Cyril Raffaelli, David Belle, Philippe Torreton","Action, Crime, Thriller",101 min 
1752,Assault of the Sasquatch,2009,Andrew Gernhard,"Kevin Shea, Greg Nutcher, Sarah J. Ahearn","Action, Horror",85 min 
1753,Give 'em Hell Malone,2009,Russell Mulcahy,"Thomas Jane, Ving Rhames, Elsa Pataky","Action, Crime, Thriller",96 min 
1754,Fading of the Cries,2009,Steven Maguire,"Brad Dourif, Mackenzie Rosman, Hallee Hirsh","Action, Fantasy, Horror",94 min 
1755,Woochi,2009,Dong-hoon Choi,"Yun-seok Kim, Dong-won Kang, Jung-ah Yum","Action, Adventure, Comedy",136 min 
1756,Kaminey: The Scoundrels,2009,Vishal Bhardwaj,"Shahid Kapoor, Priyanka Chopra, Deb Mukherjee","Action, Comedy, Crime",130 min 
1757,Apocalypse Female Warriors,2009,Len Kabasinski,"Brian Anthony, Brian Arrington, Gary Barickman",Action,88 min 
1758,Shoot the Duke,2009,Stephen Manuel,"Stephen Baldwin, Bettina Zimmermann, Thomas Heinze","Action, Comedy, Thriller",77 min 
1759,Ghost Machine,2009,Chris Hartwill,"Sean Faris, Rachael Taylor, Luke Ford","Action, Sci-Fi, Thriller",100 min 
1760,Dossier K.,2009,Jan Verheyen,"Koen De Bouw, Werner De Smedt, Blerim Destani","Action, Crime, Drama",120 min 
1761,Universal Soldier: Regeneration,2009,John Hyams,"Dolph Lundgren, Jean-Claude Van Damme, Andrei Arlovski","Action, Adventure, Sci-Fi",97 min 
1762,Harry Brown,2009,Daniel Barber,"Michael Caine, Emily Mortimer, David Bradley","Action, Crime, Drama",103 min 
1763,Kung Fu Flid,2009,Xavier Leret,"Frank Harper, Mat Fraser, Terry Stone","Action, Comedy, Crime",90 min 
1764,Double Identity,2009,Dennis Dimster,"Val Kilmer, Izabella Miko, Julian Wadham","Action, Crime, Thriller",93 min 
1765,Dragon Hunter,2009,Stephen Shimek,"Kelly Stables, Brad Johnson, Newell Alexander","Action, Adventure, Fantasy",90 min 
1766,The Keeper,2009,Keoni Waxman,"Steven Seagal, Liezl Carstens, Arron Shiver","Action, Crime, Thriller",94 min 
1767,Road of No Return,2009,Parviz Saghizadeh,"Michael Madsen, David Carradine, Michael Blain-Rozgay","Action, Drama",91 min 
1768,The Warrior and the Wolf,2009,Zhuangzhuang Tian,"Maggie Q, Joe Odagiri, Chung-Hua Tou","Action, Drama, History",101 min 
1769,The Boondock Saints II: All Saints Day,2009,Troy Duffy,"Sean Patrick Flanery, Norman Reedus, Billy Connolly","Action, Comedy, Crime",118 min 
1770,Born of Hope,2009,Kate Madison,"Christopher Dane, Beth Aynsley, Kate Madison","Action, Adventure, Fantasy",71 min 
1771,Never Surrender,2009,Hector Echavarria,"Hector Echavarria, Patrick Kilpatrick, James Russo","Action, Drama, Thriller",87 min 
1772,Musashi: The Dream of the Last Samurai,2009,Mizuho Nishikubo,,"Animation, Action",72 min 
1773,Dead Man Running,2009,Alex De Rakoff,"Tamer Hassan, Clint Koroan, Fredi 'Kruga' Nwaka","Action, Crime, Drama",92 min 
1774,Damage,2009,Jeff King,"Steve Austin, Walton Goggins, Laura Vandervoort","Action, Drama",102 min 
1775,Machotaildrop,2009,Corey Adams,"Anthony Amedori, James Faulkner, Rick McCrank","Action, Comedy, Fantasy",91 min 
1776,The Sky Has Fallen,2009,Doug Roos,"Carey MacLaren, Laurel Kemper, Cory Knisely","Action, Drama, Horror",80 min 
1777,Ballistica,2009,Gary Jones,"Paul Logan, Martin Kove, Robert Davi","Action, Adventure",90 min 
1778,Kal Kissne Dekha,2009,Vivek Sharma,"Brahim Achabbakhe, Jacky Bhagnani, Nushrat Bharucha","Action, Crime, Romance",134 min 
1779,Yesterday,2009,Rob Grant,"Graham Wardle, P. Lynn Johnson, Bill Murdoch","Action, Comedy, Drama",95 min 
1780,Red Cliff II,2009,John Woo,"Tony Chiu Wai Leung, Takeshi Kaneshiro, Fengyi Zhang","Action, Drama, History",142 min 
1781,Chrome Angels,2009,Leigh Scott,"Stacey Dash, Frida Farrell, Monti Domingue","Action, Sci-Fi",93 min 
1782,Vengeance,2009,Johnnie To,"Johnny Hallyday, Sylvie Testud, Anthony Chau-Sang Wong","Action, Crime, Drama",108 min 
1783,Black Angels,2009,Arthur Muhammad,"Gabriel D. Angell, Lonice Bell, Shannon Ase Brown","Action, Drama",87 min 
1784,Hellbinders,2009,Mitch Gould,"Ray Park, Johnny Yong Bosch, Esteban Cueto","Action, Fantasy, Horror",90 min 
1785,Killer Bean Forever,2009,Jeff Lew,"Vegas E. Trip, Bryan Session, David Guilmette","Animation, Action, Comedy",85 min 
1786,First Squad: The Moment of Truth,2009,Yoshiharu Ashino,"Elena Chebaturkina, Michael Tikhonov, Damir Eldarov","Animation, Action, Drama",73 min 
1787,Tactical Unit - Comrades in Arms,2009,Wing-cheong Law,"Simon Yam, Maggie Siu, Suet Lam","Action, Crime, Drama",91 min 
1788,The Black Knight Returns,2009,Juan Avilez,"Adam Salandra, Win De Lugo, Cheryl Texiera","Action, Adventure, Sci-Fi",87 min 
1789,Killer Biker Chicks,2009,Regan Redding,"Brenna Roth, Sara Plotkin, Sarah French","Action, Comedy, Horror",100 min 
1790,Kara no Kyoukai: The Garden of Sinners - A Study in Murder - Part 2,2009,Shinsuke Takizawa,"Maaya Sakamoto, Ken'ichi Suzumura, Takako Honda","Animation, Action, Crime",120 min 
1791,Overheard,2009,Felix Chong,"Daniel Wu, Jingchu Zhang, Grace Huang","Action, Thriller",100 min 
1792,The Unbeatable,2009,Anand K.V.,"Suriya, Tamannaah Bhatia, Prabhu",Action,162 min 
1793,Ang Panday,2009,Mac Alejandre,"Ramon 'Bong' Revilla Jr., Phillip Salvador, Iza Calzado","Action, Adventure, Comedy",110 min 
1794,Merantau,2009,Gareth Evans,"Iko Uwais, Sisca Jessica, Christine Hakim","Action, Drama",134 min 
1795,Kung Fu Chefs,2009,Wing Kin Yip,"Sammo Kam-Bo Hung, Vanness Wu, Cherrie Ying","Action, Comedy",92 min 
1796,Naan Kadavul,2009,Bala,"Arya, Pooja Umashankar, Rajendran","Action, Drama",165 min 
1797,Marine Boy,2009,Jong-seok Yoon,"Kang-woo Kim, Jae-hyeon Jo, Si-Yeon Park","Action, Thriller",118 min 
1798,RoboGeisha,2009,Noboru Iguchi,"Asami, Yoshihiro Nishimura, Naoto Takenaka","Action, Comedy, Sci-Fi",102 min 
1799,Nun of That,2009,Richard Griffin,"Sarah Nicklin, Alexandra Cipolla, Shanette Wilson","Action, Comedy",91 min 
1800,Aaron... Albeit a Sex Hero,2009,Paul Bright,"Matthew Burnett, Rafiel Soto, Christopher Lee Gibson","Action, Comedy, Thriller",82 min 
1801,The Dark Lurking,2009,Gregory Connors,"Tonia Renee, Bret Kennedy, Ozzie Devrish","Action, Horror, Sci-Fi",97 min 
1802,Ninja Masters,2009,Xin Xin Xiong,"Luxia Jiang, Sam Lee, Siu-Fai Cheung","Action, Crime",87 min 
1803,Wrong Turn at Tahoe,2009,Franck Khalfoun,"Cuba Gooding Jr., Miguel Ferrer, Harvey Keitel","Action, Crime, Drama",91 min 
1804,Obitaemyy ostrov. Skhvatka,2009,Fedor Bondarchuk,"Vasiliy Stepanov, Yuliya Snigir, Pyotr Fyodorov","Action, Adventure, Sci-Fi",105 min 
1805,Bodyguards and Assassins,2009,Teddy Chan,"Xueqi Wang, Tony Ka Fai Leung, Jun Hu","Action, Drama, History",139 min 
1806,Hardwired,2009,Ernie Barbarash,"Cuba Gooding Jr., Val Kilmer, Michael Ironside","Action, Sci-Fi",94 min 
1807,Everybody Dies,2009,Josh Evans,"Sergio d'Amato, Federico Galavis, Joanne Baron",Action,76 min 
1808,Blood,2009,Ten Shimoyama,"Aya Sugimoto, Guts Ishimatsu, Jun Kaname","Action, Horror",85 min 
1809,Fireball,2009,Thanakorn Pongsuwan,"Preeti Barameeanat, Khanutra Chuchuaysuwan, Kumpanat Oungsoongnern","Action, Drama",94 min 
1810,My Girlfriend Is an Agent,2009,Terra Shin,"HaNeul Kim, Ji-Hwan Kang, Seung-ryong Ryu","Action, Comedy, Romance",112 min 
1811,All the Best: Fun Begins,2009,Rohit Shetty,"Sanjay Dutt, Ajay Devgn, Fardeen Khan","Action, Comedy, Drama",144 min 
1812,Echelon 8,2009,Joe Valenti,"David Wenzel, Rick Lohman, Russell Friedenberg","Action, Crime, Drama",118 min 
1813,Red & White,2009,Yadi Sugandi,"Donny Alamsyah, Rahayu Saraswati, Lukman Sardi","Action, Drama, War",108 min 
1814,Bangkok Adrenaline,2009,Raimund Huber,"Daniel Patrick O'Neill, Priya Suandokemai, Gwion Jacob Miles","Action, Comedy",90 min 
1815,Magadheera,2009,S.S. Rajamouli,"Ram Charan, Kajal Agarwal, Dev Gill","Action, Drama, Romance",166 min 
1816,Ek: The Power of One,2009,Sangeeth Sivan,"Rana Jung Bahadur, Jaspal Bhatti, Preeti Bhutani","Action, Drama, Thriller",140 min 
1817,Team: The Force,2009,Ajay Chandhok,,"Action, Comedy, Crime",115 min 
1818,Eden of the East the Movie I: The King of Eden,2009,Kenji Kamiyama,"Christine M. Auten, John Burgmeier, Leah Clark","Animation, Action, Comedy",80 min 
1819,The Sword with No Name,2009,Yong-gyun Kim,"Seung-woo Cho, Soo Ae, Sophie Broustal","Action, Drama",124 min 
1820,Hottarake no shima - Haruka to maho no kagami,2009,Shinsuke Sato,"Christine Marie Cabanos, Patrick Seitz, Julie Maddalena","Animation, Action, Adventure",93 min 
1821,Frankenpimp,2009,Vivita,"Tony Watt, Vivita, Martin Magee","Action, Comedy, Fantasy",194 min 
1822,Looking for Jackie,2009,Gangliang Fang,"Yishan Zhang, Jackie Chan, Qixing Aisin-Gioro","Action, Comedy, Family",85 min 
1823,Zombie Punch,2009,Silver Kim,"Emily Tennant, Landon Liboiron, James Pizzinato","Action, Horror, Thriller",103 min 
1824,Assault Girls,2009,Mamoru Oshii,"Yoshikazu Fujiki, Rinko Kikuchi, Meisa Kuroki","Action, Sci-Fi",65 min 
1825,Horrid,2009,James Pronath,"Scott Annala, Kyle Berg, Russ Borchardt","Action, Horror",92 min 
