ID,Title,Year,Director,Cast,Genre,Duration
4989,A Breed Apart,1984,Philippe Mora,"Rutger Hauer, Powers Boothe, Kathleen Turner","Drama, Action",95 min 
4990,Cannonball Run II,1984,Hal Needham,"Burt Reynolds, Dom DeLuise, Frank Sinatra","Action, Comedy",108 min 
4991,City Heat,1984,Richard Benjamin,"Clint Eastwood, Burt Reynolds, Jane Alexander","Action, Comedy, Crime",93 min 
4992,Cloak & Dagger,1984,Richard Franklin,"Henry Thomas, Dabney Coleman, Michael Murphy","Action, Adventure, Crime",101 min 
4993,Code Name: Wild Geese,1984,Antonio Margheriti,"Lewis Collins, Lee Van Cleef, Ernest Borgnine","Action, War",101 min 
4994,Conan the Destroyer,1984,Richard Fleischer,"Arnold Schwarzenegger, Grace Jones, Olivia d'Abo","Action, Adventure, Fantasy",103 min 
4995,Dang doi lai ming,1984,Po-Chih Leong,"Yun-Fat Chow, Cecilia Yip, Alex Man","Action, War",100 min 
4996,Dune,1984,David Lynch,"Kyle MacLachlan, Virginia Madsen, Francesca Annis","Action, Adventure, Sci-Fi",137 min 
4997,The Evil That Men Do,1984,J. Lee Thompson,"Charles Bronson, Theresa Saldana, Joseph Maher","Action, Drama, Thriller",90 min 
4998,Exterminator 2,1984,Mark Buntzman,"Robert Ginty, Mario Van Peebles, Deborah Geffner","Action, Crime, Drama",89 min 
4999,Firestarter,1984,Mark L. Lester,"Drew Barrymore, David Keith, Freddie Jones","Action, Horror, Sci-Fi",114 min 
5000,Flashpoint,1984,William Tannen,"Kris Kristofferson, Treat Williams, Rip Torn","Action, Crime, Drama",94 min 
5001,A Man Called Rage,1984,Tonino Ricci,"Bruno Minniti, Stelio Candelli, Werner Pochath","Action, Thriller, Sci-Fi",90 min 
5002,Godzilla 1985,1984,Koji Hashimoto,"Raymond Burr, Ken Tanaka, Yasuko Sawaguchi","Action, Horror, Sci-Fi",103 min 
5003,Hell Riders,1984,James Bryan,"Tina Louise, Adam West, Ross Alexander","Action, Drama",90 min 
5004,The Ice Pirates,1984,Stewart Raffill,"Robert Urich, Mary Crosby, Michael D. Roberts","Action, Adventure, Comedy",91 min 
5005,Deadly Impact,1984,Fabrizio De Angelis,"Bo Svenson, Fred Williamson, Marcia Clingan","Action, Crime, Drama",80 min 
5006,Indiana Jones and the Temple of Doom,1984,Steven Spielberg,"Harrison Ford, Kate Capshaw, Jonathan Ke Quan","Action, Adventure",118 min 
5007,Johnny Dangerously,1984,Amy Heckerling,"Michael Keaton, Joe Piscopo, Marilu Henner","Action, Comedy, Crime",90 min 
5008,Jungle Warriors,1984,Ernst R. von Theumer,"Nina van Pallandt, Paul L. Smith, John Vernon","Action, Adventure, Drama",93 min 
5009,The Karate Kid,1984,John G. Avildsen,"Ralph Macchio, Pat Morita, Elisabeth Shue","Action, Drama, Family",126 min 
5010,Killpoint,1984,Frank Harris,"Leo Fong, Richard Roundtree, Cameron Mitchell",Action,80 min 
5011,Wheels on Meals,1984,Sammo Kam-Bo Hung,"Jackie Chan, Biao Yuen, Sammo Kam-Bo Hung","Action, Comedy, Crime",100 min 
5012,Lassiter,1984,Roger Young,"Tom Selleck, Jane Seymour, Lauren Hutton","Action, Crime, Drama",100 min 
5013,The Last Starfighter,1984,Nick Castle,"Lance Guest, Robert Preston, Kay E. Kuter","Action, Adventure, Sci-Fi",101 min 
5014,Lightning Fists of Shaolin,1984,Chia Tang,"Lung Ti, Te-Lo Mai, Hsueh-Hua Liu","Action, Drama",85 min 
5015,Black List,1984,Alain Bonnot,"Annie Girardot, Paul Crauchet, Bernard Brieux",Action,83 min 
5016,Super Space Fortress Macross,1984,Noboru Ishiguro,"Arihiro Hase, Mari Iijima, Mika Doi","Animation, Action, Adventure",114 min 
5017,Missing in Action,1984,Joseph Zito,"Chuck Norris, M. Emmet Walsh, David Tress","Action, Adventure, Drama",101 min 
5018,The Naked Face,1984,Bryan Forbes,"Roger Moore, Rod Steiger, Elliott Gould","Action, Mystery, Thriller",103 min 
5019,The Pope of Greenwich Village,1984,Stuart Rosenberg,"Eric Roberts, Mickey Rourke, Daryl Hannah","Action, Comedy, Crime",121 min 
5020,Red Dawn,1984,John Milius,"Patrick Swayze, C. Thomas Howell, Lea Thompson","Action, Drama, War",114 min 
5021,Romancing the Stone,1984,Robert Zemeckis,"Michael Douglas, Kathleen Turner, Danny DeVito","Action, Adventure, Comedy",106 min 
5022,Runaway,1984,Michael Crichton,"Tom Selleck, Cynthia Rhodes, Gene Simmons","Action, Crime, Sci-Fi",99 min 
5023,Savage Streets,1984,Danny Steinmann,"Linda Blair, John Vernon, Robert Dryer","Action, Crime",93 min 
5024,Devil Fish,1984,Lamberto Bava,"Michael Sopkiw, Valentine Monnier, Gianni Garko","Action, Horror, Thriller",90 min 
5025,Pom Pom,1984,Tung Cho 'Joe' Cheung,"Richard Ng, John Sham, Deannie Yip","Action, Comedy",100 min 
5026,Long Arm of the Law,1984,Johnny Mak,"Jing Chen, Ling Chow, Jian Huang","Action, Crime",100 min 
5027,Star Trek III: The Search for Spock,1984,Leonard Nimoy,"William Shatner, Leonard Nimoy, DeForest Kelley","Action, Adventure, Sci-Fi",105 min 
5028,Supergirl,1984,Jeannot Szwarc,"Helen Slater, Faye Dunaway, Peter O'Toole","Action, Adventure, Fantasy",105 min 
5029,Tank,1984,Marvin J. Chomsky,"James Garner, Shirley Jones, C. Thomas Howell","Action, Drama, Comedy",113 min 
5030,Toy Soldiers,1984,David Fisher,"Jason Miller, Cleavon Little, Rodolfo de Anda","Drama, Action",91 min 
5031,Drunken Tai Chi,1984,Woo-Ping Yuen,"Donnie Yen, Cheung-Yan Yuen, Lydia Shum","Action, Comedy",91 min 
5032,Mad Mission 3: Our Man from Bond Street,1984,Hark Tsui,"Samuel Hui, Karl Maka, Sylvia Chang","Action, Comedy",81 min 
5033,Blastfighter,1984,Lamberto Bava,"Michael Sopkiw, Valentina Forte, George Eastman","Action, Crime, Drama",87 min 
5034,The Manhunt,1984,Fabrizio De Angelis,"Ethan Wayne, Henry Silva, Bo Svenson","Action, Crime, Drama",91 min 
5035,City Limits,1984,Aaron Lipstadt,"John Stockwell, Darrell Larson, Rae Dawn Chong","Sci-Fi, Action, Drama",86 min 
5036,Women in Fury,1984,Michele Massimo Tarantini,"Suzane Carvalho, Rossana Ghessa, Gloria Cristal","Action, Drama, Thriller",90 min 
5037,The Lost Empire,1984,Jim Wynorski,"Melanie Vincz, Raven De La Croix, Angela Aames","Action, Adventure, Comedy",83 min 
5038,Trancers,1984,Charles Band,"Tim Thomerson, Helen Hunt, Michael Stefani","Action, Sci-Fi",76 min 
5039,Final Mission,1984,Cirio H. Santiago,"Richard Young, Christine L. Tudor, Jason Ross","Action, Crime",101 min 
5040,Ghost Warrior,1984,J. Larry Carroll,"Hiroshi Fujioka, John Calvin, Janet Julian","Action, Sci-Fi",81 min 
5041,Tong chiu ho fong nui,1984,Eddie Ling-Ching Fong,"Pat Ha, Alex Man, Kuo-Chu Chang","Action, Drama",102 min 
5042,Panther Squad,1984,Pierre Chevalier,"Sybil Danning, Jack Taylor, Karin Schubert","Action, Sci-Fi",77 min 
5043,Sohni Mahiwal,1984,Latif Faiziyev,"Sunny Deol, Poonam Dhillon, Pran","Action, Adventure, Drama",142 min 
5044,Chain Gang,1984,Worth Keeter,"Earl Owensby, Barry Bell, Robert Bloodworth","Action, Drama",90 min 
5045,Ninja Thunderbolt,1984,Ming Chin,"Richard Harrison, Don Wong, Yasuaki Kurata",Action,91 min 
5046,Nomad Riders,1984,Frank Roach,"Tony Laschi, Wayne Chema, Richard Kluck",Action,82 min 
5047,Hell Behind the Bars,1984,Gianni Siragusa,"Ajita Wilson, Rita Silva, Linda Jones",Action,82 min 
5048,Dragon Attack,1983,Yen-Ping Chu,"Jackie Chan, Brigitte Lin, Yu Wang","Action, Adventure, Comedy",90 min 
5049,Shao Lin yu Wu Dang,1983,Chia-Hui Liu,"Chia-Hui Liu, Adam Cheng, Li Ching",Action,87 min 
5050,Ironmaster,1983,Umberto Lenzi,"Sam Pasco, Elvire Audray, George Eastman","Action, Adventure",98 min 
5051,Warriors of the Wasteland,1983,Enzo G. Castellari,"Giancarlo Prete, Fred Williamson, George Eastman","Action, Sci-Fi, Thriller",91 min 
5052,Vigilante,1983,William Lustig,"Robert Forster, Fred Williamson, Richard Bright","Action, Crime, Thriller",90 min 
5053,Duel to Death,1983,Siu-Tung Ching,"Norman Chu, Damian Lau, Flora Cheung","Action, Drama",86 min 
5054,2019: After the Fall of New York,1983,Sergio Martino,"Michael Sopkiw, Valentine Monnier, George Eastman","Action, Horror, Sci-Fi",96 min 
5055,Project A,1983,Jackie Chan,"Jackie Chan, Sammo Kam-Bo Hung, Biao Yuen","Action, Comedy",105 min 
5056,Angel of H.E.A.T.,1983,Myrl A. Schreibman,"Marilyn Chambers, Stephen Johnson, Mary Woronov","Action, Sci-Fi",93 min 
5057,Women's Prison Massacre,1983,Bruno Mattei,"Laura Gemser, Gabriele Tinti, Ursula Flores","Action, Drama",89 min 
5058,Blue Thunder,1983,John Badham,"Roy Scheider, Warren Oates, Candy Clark","Action, Crime, Drama",109 min 
5059,Chained Heat,1983,Paul Nicholas,"Linda Blair, John Vernon, Sybil Danning","Action, Crime, Drama",95 min 
5060,Christine,1983,John Carpenter,"Keith Gordon, John Stockwell, Alexandra Paul","Action, Drama, Horror",110 min 
5061,Coolie,1983,Manmohan Desai,"Amitabh Bachchan, Waheeda Rehman, Rishi Kapoor","Drama, Action, Comedy",177 min 
5062,D.C. Cab,1983,Joel Schumacher,"Max Gail, Adam Baldwin, Mr. T","Comedy, Action",100 min 
5063,Deadline Auto Theft,1983,H.B. Halicki,"H.B. Halicki, Hoyt Axton, Marion Busia","Action, Comedy, Drama",98 min 
5064,Deadly Force,1983,Paul Aaron,"Wings Hauser, Joyce Ingalls, Paul Shenar","Action, Crime, Drama",95 min 
5065,Durdesh,1983,Ambrish Sangal,"Shashi Kapoor, Sharmila Tagore, Parveen Babi","Action, Crime, Drama",143 min 
5066,Eddie Macon's Run,1983,Jeff Kanew,"Kirk Douglas, John Schneider, Lee Purcell","Action, Crime, Drama",95 min 
5067,Go for It,1983,Enzo Barboni,"Terence Hill, Bud Spencer, Buffy Dee","Action, Adventure, Comedy",107 min 
5068,Krull,1983,Peter Yates,"Ken Marshall, Lysette Anthony, Freddie Jones","Action, Adventure, Fantasy",121 min 
5069,Lone Wolf McQuade,1983,Steve Carver,"Chuck Norris, David Carradine, Barbara Carrera","Action, Crime, Drama",107 min 
5070,Fearless Hyena 2,1983,Chuan Chen,,Action,92 min 
5071,The Man Who Wasn't There,1983,Bruce Malmuth,"Steve Guttenberg, Jeffrey Tambor, Art Hindle","Action, Adventure, Comedy",111 min 
5072,Le marginal,1983,Jacques Deray,"Jean-Paul Belmondo, Henry Silva, Carlos Sotto Mayor","Action, Crime, Drama",100 min 
5073,Metalstorm: The Destruction of Jared-Syn,1983,Charles Band,"Jeffrey Byron, Michael Preston, Tim Thomerson","Adventure, Sci-Fi, Action",84 min 
5074,Midnite Spares,1983,Quentin Masters,"James Laurie, Gia Carides, Max Cullen","Action, Adventure, Comedy",87 min 
5075,Savage Islands,1983,Ferdinand Fairfax,"Tommy Lee Jones, Michael O'Keefe, Max Phipps","Action, Adventure, Comedy",99 min 
5076,Never Say Never Again,1983,Irvin Kershner,"Sean Connery, Kim Basinger, Klaus Maria Brandauer","Action, Adventure, Romance",134 min 
5077,Octopussy,1983,John Glen,"Roger Moore, Maud Adams, Louis Jourdan","Action, Adventure, Thriller",131 min 
5078,The Osterman Weekend,1983,Sam Peckinpah,"Rutger Hauer, John Hurt, Craig T. Nelson","Action, Drama, Thriller",103 min 
5079,Hearts and Armour,1983,Giacomo Battiato,"Zeudi Araya Cristaldi, Barbara De Rossi, Rick Edwards","Action, Adventure, Fantasy",98 min 
5080,Please Don't Eat the Babies,1983,Henri Charr,"Elizabeth Monet, Tanya Louise, Michael Wayne","Action, Horror",88 min 
5081,The Raiders of Atlantis,1983,Ruggero Deodato,"Christopher Connelly, Gioia Scola, Tony King","Action, Sci-Fi",98 min 
5082,Prisoners of the Lost Universe,1983,Terry Marcel,"Richard Hatch, Kay Lenz, John Saxon","Action, Adventure, Sci-Fi",94 min 
5083,I sette magnifici gladiatori,1983,Claudio Fragasso,"Lou Ferrigno, Sybil Danning, Brad Harris","Action, Adventure, Drama",83 min 
5084,Shu Shan - Xin Shu shan jian ke,1983,Hark Tsui,"Biao Yuen, Adam Cheng, Brigitte Lin","Action, Adventure, Fantasy",95 min 
5085,Space Raiders,1983,Howard R. Cohen,"Vince Edwards, David Mendenhall, Patsy Pease","Action, Adventure, Sci-Fi",84 min 
5086,Spacehunter: Adventures in the Forbidden Zone,1983,Lamont Johnson,"Peter Strauss, Molly Ringwald, Ernie Hudson","Action, Adventure, Sci-Fi",90 min 
5087,Stroker Ace,1983,Hal Needham,"Burt Reynolds, Ned Beatty, Jim Nabors","Action, Comedy, Romance",96 min 
5088,Stryker,1983,Cirio H. Santiago,"Steve Sandor, Andrea Savio, William Ostrander","Action, Sci-Fi",86 min 
5089,Sudden Impact,1983,Clint Eastwood,"Clint Eastwood, Sondra Locke, Pat Hingle","Action, Thriller",117 min 
5090,Superman III,1983,Richard Lester,"Christopher Reeve, Richard Pryor, Margot Kidder","Action, Comedy, Sci-Fi",125 min 
5091,Thunder,1983,Fabrizio De Angelis,"Bo Svenson, Mark Gregory, Raimund Harmstorf","Action, Crime, Drama",86 min 
5092,The Last Blood,1983,Antonio Margheriti,"Giancarlo Prete, Antonio Marsina, Luciano Pigozzi","Action, War",90 min 
5093,Tough Enough,1983,Richard Fleischer,"Dennis Quaid, Carlene Watkins, Stan Shaw","Action, Drama, Romance",106 min 
5094,Twice Upon a Time,1983,John Korty,"Lorenzo Music, Judith Kahan, Marshall Efron","Animation, Action, Adventure",74 min 
5095,Uncommon Valor,1983,Ted Kotcheff,"Gene Hackman, Patrick Swayze, Robert Stack","Action, Drama, Thriller",105 min 
5096,Veliki transport,1983,Veljko Bulajic,"James Franciscus, Steve Railsback, Edward Albert","Action, Drama, War",134 min 
5097,Winners & Sinners,1983,Sammo Kam-Bo Hung,"Sammo Kam-Bo Hung, Jackie Chan, John Sham","Action, Comedy, Crime",108 min 
5098,Yellowbeard,1983,Mel Damski,"Graham Chapman, Peter Boyle, Cheech Marin","Action, Adventure, Comedy",96 min 
5099,Young Warriors,1983,Lawrence David Foldes,"Ernest Borgnine, Richard Roundtree, Lynda Day George","Crime, Action, Drama",105 min 
5100,Mad Mission Part 2: Aces Go Places,1983,Eric Tsang,"Samuel Hui, Karl Maka, Sylvia Chang","Action, Comedy",100 min 
5101,Warrior of the Lost World,1983,David Worth,"Robert Ginty, Persis Khambatta, Donald Pleasence","Sci-Fi, Action",92 min 
5102,Endgame - Bronx lotta finale,1983,Joe D'Amato,"Al Cliver, Laura Gemser, George Eastman","Action, Sci-Fi",98 min 
5103,Escape from the Bronx,1983,Enzo G. Castellari,"Mark Gregory, Henry Silva, Valeria D'Obici","Action, Sci-Fi, Thriller",89 min 
5104,Il trono di fuoco,1983,Franco Prosperi,"Sabrina Siani, Pietro Torrisi, Harrison Muller Jr.","Action, Fantasy, Adventure",89 min 
5105,Escape from Hellhole,1983,Maman Firmansyah,"Gudi Sintara, Dicky Zulkarnaen, Siska Widowati","Action, Thriller",100 min 
5106,Himmatwala,1983,K. Raghavendra Rao,"Shoma Anand, Asrani, Arun Govil","Drama, Action, Comedy",179 min 
5107,Justice Chaudhury,1983,K. Raghavendra Rao,"Jeetendra, Hema Malini, Sridevi","Drama, Action, Comedy",156 min 
5108,Survival Zone,1983,Percival Rubens,"Gary Lockwood, Camilla Sparv, Morgan Stevens","Action, Drama, Sci-Fi",90 min 
5109,The Shaolin Temple,1982,Hsin-Yen Chang,"Jet Li, Lan Ding, Jianqiang Hu","Action, Drama",95 min 
5110,Brave Archer 4,1982,Cheh Chang,"Sheng Fu, Tien Hsiang Lung, Philip Kwok","Action, Romance",100 min 
5111,Highpoint,1982,Peter Carter,"Richard Harris, Christopher Plummer, Beverly D'Angelo","Action, Comedy, Thriller",88 min 
5112,Ninja Strikes Back,1982,Bruce Le,"Bruce Le, Jang Lee Hwang, Harold Sakata","Action, Drama",81 min 
5113,Death Wish II,1982,Michael Winner,"Charles Bronson, Jill Ireland, Vincent Gardenia","Action, Crime, Drama",88 min 
5114,How Sleep the Brave,1982,Lindsay Shonteff,"Lawrence Day, Luis Manuel, Thomas M. Pollard","Action, Drama",88 min 
5115,All Fired Up,1982,Jean-Paul Rappeneau,"Yves Montand, Isabelle Adjani, Lauren Hutton","Comedy, Drama, Action",108 min 
5116,Xun cheng ma,1982,Ronny Yu,"Ka-Yan Leung, Cherie Chung, Yun-Fat Chow","Action, Adventure, Drama",87 min 
5117,Ten Violent Women,1982,Ted V. Mikels,"Sherri Vernon, Dixie Lauren, Sally Alice Gamble","Action, Drama",97 min 
5118,48 Hrs.,1982,Walter Hill,"Nick Nolte, Eddie Murphy, Annette O'Toole","Action, Comedy, Crime",96 min 
5119,2020 Freedom Fighters,1982,Joe D'Amato,"Al Cliver, Harrison Muller Jr., Daniel Stephen","Action, Sci-Fi",91 min 
5120,Attack Force Z,1982,Tim Burstall,"John Phillip Law, Mel Gibson, Sam Neill","Action, Drama, History",84 min 
5121,The Beastmaster,1982,Don Coscarelli,"Marc Singer, Tanya Roberts, Rip Torn","Action, Adventure, Drama",118 min 
5122,Ru lai shen zhang,1982,Taylor Wong,"Tung-Shing Yee, On-On Yu, Kara Hui","Action, Fantasy",93 min 
5123,Class of 1984,1982,Mark L. Lester,"Perry King, Merrie Lynn Ross, Timothy Van Patten","Action, Crime, Drama",98 min 
5124,Fake-Out,1982,Matt Cimber,"Telly Savalas, Pia Zadora, Desi Arnaz Jr.","Action, Comedy, Crime",96 min 
5125,Ferocious Female Freedom Fighters,1982,Jopi Burnama,"Eva Arnaz, Barry Prima, Leily Sagita","Action, Comedy",93 min 
5126,Fighting Back,1982,Lewis Teague,"Tom Skerritt, Patti LuPone, Michael Sarrazin","Action, Crime, Drama",98 min 
5127,The Final Option,1982,Ian Sharp,"Lewis Collins, Judy Davis, Richard Widmark","Action, Thriller",125 min 
5128,Firefox,1982,Clint Eastwood,"Clint Eastwood, Freddie Jones, David Huffman","Action, Adventure, Sci-Fi",136 min 
5129,First Blood,1982,Ted Kotcheff,"Sylvester Stallone, Brian Dennehy, Richard Crenna","Action, Thriller",93 min 
5130,Forced Vengeance,1982,James Fargo,"Chuck Norris, Mary Louise Weller, Camila Griggs","Action, Adventure, Crime",90 min 
5131,Hanky Panky,1982,Sidney Poitier,"Gene Wilder, Gilda Radner, Kathleen Quinlan","Action, Comedy, Crime",110 min 
5132,Hunters of the Golden Cobra,1982,Antonio Margheriti,"David Warbeck, Almanta Suska, Luciano Pigozzi","Action, Adventure, War",92 min 
5133,Huo Yuan-Jia,1982,Woo-Ping Yuen,"Yao Lin Chen, Yeh Fang, Fung Fung","Action, History",89 min 
5134,The Junkman,1982,H.B. Halicki,"H.B. Halicki, Christopher Stone, Susan Shaw","Action, Comedy, Crime",96 min 
5135,Dragon Strike,1982,Jackie Chan,"Jackie Chan, Mars, Wai-Man Chan","Action, Comedy, Sport",102 min 
5136,Ninja in the Dragon's Den,1982,Corey Yuen,,"Action, Comedy",95 min 
5137,Megaforce,1982,Hal Needham,"Barry Bostwick, Michael Beck, Persis Khambatta","Sci-Fi, Action",99 min 
5138,Kung Fu Cannibals,1982,Edward D. Murphy,"Cameron Mitchell, Geoffrey Binney, Hope Holiday","Adventure, Horror, Action",86 min 
5139,Human Lanterns,1982,Chung Sun,"Tony Liu, Kuan Tai Chen, Lieh Lo","Horror, Action",95 min 
5140,Running on Empty,1982,John Clark,"Terry Serio, Deborah Conway, Max Cullen","Action, Drama, Sport",83 min 
5141,Safari 3000,1982,Harry Hurwitz,"David Carradine, Stockard Channing, Christopher Lee","Action, Adventure, Comedy",92 min 
5142,Satte Pe Satta,1982,Raj N. Sippy,"Amitabh Bachchan, Hema Malini, Ranjeeta Kaur","Action, Comedy, Drama",160 min 
5143,Shakti,1982,Ramesh Sippy,"Dilip Kumar, Amitabh Bachchan, Rakhee Gulzar","Action, Crime, Drama",166 min 
5144,Legendary Weapons of China,1982,Chia-Liang Liu,"Yung Chan, Tiet Wo Chu, Sheng Fu","Action, Drama",109 min 
5145,Silent Rage,1982,Michael Miller,"Chuck Norris, Ron Silver, Steven Keats","Action, Horror, Sci-Fi",103 min 
5146,The Soldier,1982,James Glickenhaus,"Ken Wahl, Alberta Watson, Jeremiah Sullivan","Action, Adventure, Thriller",96 min 
5147,The Spirit of the Sword,1982,Yuen Chor,"Man-No Chen, Ying Cheung, Mary Hon","Action, Drama",92 min 
5148,Star Trek II: The Wrath of Khan,1982,Nicholas Meyer,"William Shatner, Leonard Nimoy, DeForest Kelley","Action, Adventure, Drama",113 min 
5149,The Sword and the Sorcerer,1982,Albert Pyun,"Lee Horsley, Kathleen Beller, Simon MacCorkindale","Action, Fantasy, Adventure",99 min 
5150,Tag: The Assassination Game,1982,Nick Castle,"Robert Carradine, Linda Hamilton, Kristine DeBell","Action, Thriller",90 min 
5151,They Call Me Bruce?,1982,Elliott Hong,"Margaux Hemingway, Johnny Yune, Raf Mauro","Comedy, Action",87 min 
5152,Things Are Tough All Over,1982,Thomas K. Avildsen,"Toni Attell, Mike Bacarella, Billy Beck","Comedy, Action",90 min 
5153,TRON,1982,Steven Lisberger,"Jeff Bridges, Bruce Boxleitner, David Warner","Action, Adventure, Sci-Fi",96 min 
5154,Vice Squad,1982,Gary Sherman,"Season Hubley, Gary Swanson, Wings Hauser","Action, Crime, Drama",97 min 
5155,Vidhaata,1982,Subhash Ghai,,"Drama, Family, Action",168 min 
5156,Violenza in un carcere femminile,1982,Bruno Mattei,"Laura Gemser, Gabriele Tinti, Maria Romano","Action, Thriller",90 min 
5157,Battletruck,1982,Harley Cokeliss,"Michael Beck, Annie McEnroe, James Wainwright","Action, Adventure, Sci-Fi",91 min 
5158,Five Element Ninjas,1982,Cheh Chang,"Tien-chi Cheng, Tien Hsiang Lung, Meng Lo","Action, Drama",107 min 
5159,Mad Mission,1982,Eric Tsang,"Samuel Hui, Karl Maka, Sylvia Chang","Action, Comedy",93 min 
5160,1990: The Bronx Warriors,1982,Enzo G. Castellari,"Mark Gregory, Fred Williamson, Vic Morrow","Action, Sci-Fi, Thriller",89 min 
5161,Gold Raiders,1982,Pakdeevijit Chalong,,"Action, Adventure",106 min 
5162,Sorceress,1982,Jack Hill,"Leigh Harris, Lynette Harris, Roberto Nelson","Action, Fantasy, Adventure",83 min 
5163,Timerider: The Adventure of Lyle Swann,1982,William Dear,"Fred Ward, Belinda Bauer, Peter Coyote","Action, Adventure, Sci-Fi",94 min 
5164,Angkor: Cambodia Express,1982,Lek Kitaparaporn,"Robert Walker Jr., Woody Strode, Christopher George","Action, Drama, War",90 min 
5165,She,1982,Avi Nesher,"Sandahl Bergman, David Goss, Quin Kessler","Action, Adventure, Fantasy",106 min 
5166,Shaolin Prince,1982,Chia Tang,"Lung Ti, Derek Yee, Jason Pai Piao","Action, Comedy",100 min 
5167,Wu gong zhou,1982,Keith Li,"Hussein Abu Hassan, Chu-kwong Chan, F.C. Chan","Action, Crime, Fantasy",93 min 
5168,Disco Dancer,1982,Babbar Subhash,"Mithun Chakraborty, Kim, Kalpana Iyer","Romance, Musical, Action",135 min 
5169,The Impossible Kid of Kung Fu,1982,Eddie Nicart,"Weng Weng, Romy Diaz, Nina Sara","Action, Comedy",81 min 
5170,Aamne Samne,1982,Ashim S. Samanta,"Mithun Chakraborty, Bindiya Goswami, Arti Gupta","Action, Crime, Drama",143 min 
5171,Firecracker,1981,Cirio H. Santiago,"Jillian Kesner, Darby Hinton, Rey Malonzo","Action, Drama, Thriller",77 min 
5172,Game of Death II,1981,See-Yuen Ng,"Bruce Lee, Tae-jeong Kim, Jang Lee Hwang","Action, Mystery",86 min 
5173,She diao ying xiong chuan san ji,1981,Cheh Chang,"Sheng Fu, Niu Niu, Lung Ti","Action, Drama",92 min 
5174,Barsaat Ki Ek Raat,1981,Shakti Samanta,"Amitabh Bachchan, Rakhee Gulzar, Amjad Khan","Action, Thriller",142 min 
5175,My Young Auntie,1981,Chia-Liang Liu,"Chia-Liang Liu, Kara Hui, Hou Hsiao","Action, Comedy",121 min 
5176,The Sword Stained with Royal Blood,1981,Cheh Chang,"Philip Kwok, Hsueh-Erh Wen, Tien Hsiang Lung","Action, Drama",104 min 
5177,The Cannonball Run,1981,Hal Needham,"Burt Reynolds, Roger Moore, Farrah Fawcett","Action, Comedy",95 min 
5178,The Masked Avengers,1981,Cheh Chang,"Philip Kwok, Siu-Ho Chin, Sheng Chiang","Action, Drama",92 min 
5179,Condorman,1981,Charles Jarrott,"Michael Crawford, Oliver Reed, Barbara Carrera","Action, Adventure, Comedy",90 min 
5180,Death Hunt,1981,Peter R. Hunt,"Charles Bronson, Lee Marvin, Andrew Stevens","Action, Adventure, Crime",97 min 
5181,Dragonslayer,1981,Matthew Robbins,"Peter MacNicol, Caitlin Clarke, Ralph Richardson","Action, Adventure, Fantasy",109 min 
5182,Escape from New York,1981,John Carpenter,"Kurt Russell, Lee Van Cleef, Ernest Borgnine","Action, Sci-Fi",99 min 
5183,An Eye for an Eye,1981,Steve Carver,"Chuck Norris, Christopher Lee, Richard Roundtree","Action, Adventure, Crime",106 min 
5184,Banovic Strahinja,1981,Vatroslav Mimica,"Franco Nero, Dragan Nikolic, Sanja Vejnovic","Action, Biography, Drama",105 min 
5185,For Your Eyes Only,1981,John Glen,"Roger Moore, Carole Bouquet, Topol","Action, Adventure, Sci-Fi",127 min 
5186,Force: Five,1981,Robert Clouse,"Joe Lewis, Bong Soo Han, Sonny Barnes","Action, Adventure, Drama",96 min 
5187,Galaxy of Terror,1981,Bruce D. Clark,"Edward Albert, Erin Moran, Ray Walston","Action, Adventure, Horror",81 min 
5188,Goodbye Pork Pie,1981,Geoff Murphy,"Tony Barry, Kelly Johnson, Claire Oberman","Action, Adventure, Comedy",90 min 
5189,High Risk,1981,Stewart Raffill,"James Brolin, Anthony Quinn, Lindsay Wagner","Action, Comedy, Crime",94 min 
5190,Honky Tonk Freeway,1981,John Schlesinger,"David Rasche, Paul Jabara, Howard Hesseman","Action, Comedy",107 min 
5191,Kaalia,1981,Tinnu Anand,"Amitabh Bachchan, Asha Parekh, Parveen Babi","Action, Drama",157 min 
5192,Kill and Kill Again,1981,Ivan Hall,"James Ryan, Anneline Kriel, Michael Mayer","Action, Drama",100 min 
5193,Knightriders,1981,George A. Romero,"Ed Harris, Gary Lahti, Tom Savini","Action, Drama",146 min 
5194,The Last Chase,1981,Martyn Burke,"Lee Majors, Burgess Meredith, Chris Makepeace","Action, Adventure, Sci-Fi",101 min 
5195,Laawaris,1981,Prakash Mehra,"Zeenat Aman, Vikas Anand, Amitabh Bachchan","Drama, Action, Musical",189 min 
5196,The Legend of the Lone Ranger,1981,William A. Fraker,"Klinton Spilsbury, Michael Horse, Christopher Lloyd","Action, Adventure, Western",98 min 
5197,Lovely But Deadly,1981,David Sheldon,"Lucinda Dooling, John Randolph, Mel Novak","Action, Drama",95 min 
5198,Mad Max 2: The Road Warrior,1981,George Miller,"Mel Gibson, Bruce Spence, Michael Preston","Action, Adventure, Sci-Fi",94 min 
5199,Samurai Reincarnation,1981,Kinji Fukasaku,"Shin'ichi Chiba, Kenji Sawada, Akiko Kana","Action, Fantasy, Horror",122 min 
5200,Naseeb,1981,Manmohan Desai,"Amitabh Bachchan, Shatrughan Sinha, Rishi Kapoor","Action, Musical, Romance",197 min 
5201,Nighthawks,1981,Bruce Malmuth,"Sylvester Stallone, Rutger Hauer, Billy Dee Williams","Action, Crime, Thriller",99 min 
5202,Outland,1981,Peter Hyams,"Sean Connery, Frances Sternhagen, Peter Boyle","Action, Crime, Sci-Fi",112 min 
5203,Pour la peau d'un flic,1981,Alain Delon,"Alain Delon, Anne Parillaud, Daniel Ceccaldi","Action, Crime, Romance",105 min 
5204,The Professional,1981,Georges Lautner,"Jean-Paul Belmondo, Jean Desailly, Cyrielle Clair","Action, Crime, Drama",108 min 
5205,Treasure of the Yankee Zephyr,1981,David Hemmings,"Ken Wahl, Lesley Ann Warren, Donald Pleasence","Action, Drama, Adventure",91 min 
5206,Raiders of the Lost Ark,1981,Steven Spielberg,"Harrison Ford, Karen Allen, Paul Freeman","Action, Adventure",115 min 
5207,Sharky's Machine,1981,Burt Reynolds,"Burt Reynolds, Rachel Ward, Vittorio Gassman","Action, Crime, Drama",122 min 
5208,Smokey Bites the Dust,1981,Charles B. Griffith,"Jimmy McNichol, Janet Julian, Walter Barnes","Action, Comedy, Romance",87 min 
5209,Southern Comfort,1981,Walter Hill,"Keith Carradine, Powers Boothe, Fred Ward","Action, Thriller",106 min 
5210,Texas Lightning,1981,Gary Graver,"Cameron Mitchell, Cameron Mitchell Jr., Maureen McCormick","Action, Drama",91 min 
